papers_name,papers_abstract,papers_year,papers_keywords,papers_type,papers_country,papers_cluster_number,papers_keywords_score
Modelling for digital twins—potential role of surrogate models,"The application of white box models in digital twins is often hindered by missing knowl-edge, uncertain information and computational difficulties. Our aim was to overview the difficulties and challenges regarding the modelling aspects of digital twin applications and to explore the fields where surrogate models can be utilised advantageously. In this sense, the paper discusses what types of surrogate models are suitable for different practical problems as well as introduces the appropriate techniques for building and using these models. A number of examples of digital twin applications from both continuous processes and discrete manufacturing are presented to underline the potentials of utilising surrogate models. The surrogate models and model-building methods are categorised according to the area of applications. The importance of keeping these models up to date through their whole model life cycle is also highlighted. An industrial case study is also presented to demonstrate the applicability of the concept. © 2021 by the authors. Licensee MDPI, Basel, Switzerland.",2021,Digital twin Model life cycle Model maintenance Surrogate model,academic,"MTA-PE “Lendület” Complex Systems Monitoring Research Group, Department of Process Engineering, University of Pannonia, Egyetem Street 10, Veszprém, H-8200, Hungary",218,0.3333333333333333
Manufacturing resilience and agility through processes digital twin: Design and testing applied in the LPBF case,"Digital twins can be very promising towards offering agility and resilience in manufacturing. Especially at process level, the adaptability and the real-time optimization they can bring along is highly desired. However, digital twins, being the outcome of severe systems integration are difficult to be designed and be implemented integrating all the desired functions, such as process control and quality assessment. This work investigates the opportunity to integrate different models under the concept of a digital twin of a manufacturing process (namely LPBF) and be able to meet diverse requirements, such as adaptivity, real-time optimization and uncertainty management. The suggested framework takes into account all the phases of the digital twin, such as sensorization, modelling, diagnostic and prognostic functions and puts together an architecture including all available models and thus paving the way towards achieving to meet all the requirements. A case study is also presented showing the capabilities of the partial models utilized as well as the performance of the digital twin in closed-loop control. The digital twin is proved to be highly feasible and appears to have good performance indicators.  © 2021 The Authors. Published by Elsevier B.V.",2021,Adaptivity LPBF Manufacturing process Manufacturing resilience Process levels Quality assessment Realtime optimizations (RTO) Surrogate modeling System integration Twin design Process controlDigital Twin LPBF Manufacturing Resilience Surrogate Models,academic,"Laboratory for Manufacturing Systems and Automation (LMS), Department of Mechanical Engineering and Aeronautics, University of Patras, Rio Patras, 26504, Greece",218,0.2962962962962963
Digital-twin enabled experimentation testbed for mbse,"As Model Based Systems Engineering (MBSE) continues to advance in terms of system life cycle coverage, modeling languages, methods, and tools, there is a growing need for an overarching framework to organize MBSE artifacts and facilitate their rapid retrieval and use by MBSE researchers. Also, researchers need a simulation environment that supports exploration, experimentation with different modeling constructs and algorithms, and performance data collection over a broad range of conditions and with different assumptions. To address these requirements, this paper presents progress to date in developing a MBSE research testbed for modeling, experimentation, and verification and validation, and exploration of system behaviors over a wide range of operational scenarios and operating conditions. The testbed is intended to help researchers analyze data to uncover patterns and trends, reuse models and components as applicable, and serve as a repository for scenarios, system models, case studies, and lessons learned. Two different operational scenarios from different domains are used to convey the capabilities of the testbed. This paper presents findings and lessons learned from the prototype MBSE testbed implementation. © 2021, American Institute of Aeronautics and Astronautics Inc, AIAA. All rights reserved.",2021,Aviation Life cycle Modeling languages Algorithms and performance Coverage models Model algorithms Model method Model-based system engineerings Modeling construct Modelling tools Operational scenario Simulation environment System life cycle Testbeds,academic,"University of Southern California, Los Angeles, 90089, CA, United States; Intelligent Systems Technology, Inc., Los Angeles, 90066, CA, United States",218,0.2413793103448276
Digital twins: Understanding the added value of integrated models for through-life engineering services,"Digital twins are digital representations of physical products or systems that consist of multiple models from various domains describing them on multiple scales. By means of communication, digital twins change and evolve together with their physical counterparts throughout their lifecycle. Domain-specific partial models that make up the digital twin, such as the CAD model or the degradation model, are usually well known and provide accurate descriptions of certain parts of the physical asset. However, in complex systems, the value of integrating the partial models increases because it facilitates the study of their complex behaviours which only emerge from the interactions between various parts of the system. The paper proposes that the partial models of the digital twin share a common model space that integrates them through a definition of their interrelations and acts as a bridge between the digital twin and the physical asset. The approach is illustrated in a case of a mechatronic product - a differential drive mobile robot developed as a testbed for digital twin research. It is demonstrated how the integrated models add value to different stages of the lifecycle, allowing for evaluation of performance in the design stage and real-time reflection with the physical asset during its operation. © 2018 The Authors. Published by Elsevier B.V.",2018,Digital twin Modelling Multi-domain model,academic,"University of Ljubljana, Department of Manufacturing Systems and Control, Slovenia; Cranfield University, Through-life Engineering Services Centre, United Kingdom",218,0.4
Model-based automatic generation of digital twin models for the simulation of reconfigurable manufacturing systems for timber construction,"Reconfigurable manufacturing systems adapt to changing requirements and therefore offer a solution to the challenges associated with increasing product variety and shorter product life cycles. This is especially helpful in the prefabrication in timber construction, as components and requirements vary widely between projects. However, reconfigurations must be quick to keep downtimes short. The planning of reconfigurations is a complex problem where digital twins and simulation models of the manufacturing systems are necessary for simulation and validation. In our timber prefabrication use case, building components and requirements change from project to project, and the manufacturing system needs to reconfigure frequently. The building components and the configuration of the manufacturing system are designed simultaneously during a co-design process to ensure the integrity of the manufacturing process in a changing manufacturing environment. Hence, this may require many iterations of the planning process. Each iteration needs validation through a simulation. However, the manual generation of simulation models is time-consuming and error-prone and thus poses an obstacle for the digital planning phase. This paper addresses this issue and presents a model-based approach to generate simulation models for reconfigurable manufacturing systems. Our system and its components are modeled in automation markup language as this domain-specific language allows us to model not only kinematics and geometry but also behavior, skills, and interfaces to check the compatibility of components. We apply the method to our use case with the IntCDC wood prefabrication system. The proposed method builds a component graph for a configuration of the manufacturing system and generates the required packages for the simulation in Gazebo and ROS. To build simulation models automatically, we apply model-to-model and model-to-text transformation techniques. The proposed method is suitable for integration in the digital co-design workflow of IntCDC and allows fast iterations with continuous simulations of machine configurations throughout the planning process. © 2022 The Authors. Published by Elsevier B.V.",2022,Computer software Iterative methods Life cycle Manufacture Problem oriented languages AutomationML IntCDC Reconfigurable manufacturing system ROS Simulation Simulation model Software defined manufacturing Timber construction Timber prefabrication URDF TimberAutomationML IntCDC Reconfigurable Manufacturing System ROS Simulation Software Defined Manufacturing Timber Prefabrication URDF,academic,"Institute for Control Engineering of Machine Tools and Manufacturing Units, University of Stuttgart, Seidenstr. 36, Stuttgart, D-70174, Germany",229,0.225
Evolutionary digital twin model with an agent-based discrete-event simulation method,"A digital twin model provides the ability to adjust candidate behavior based on feedback from its physical part. However, small interactions between different subsystems and using real-time data about physical workshops are the primary problems in digital twin models. The essence of the digital twin model is the combination of the physical simulation method and the data-driven simulation method, and agent-based discrete-event modeling theory is an advanced way to build a digital twin model. Thus, the theoretical framework of the Digital Twin Workshop model is improved from the underlying modeling logic based on this new theory. By combining reinforcement learning with the digital twin workshop model, an evolutionary digital twin workshop model is developed in this study. This model is then applied to a real-world case. A comparison is made between the Digital Twin Workshop model with reinforcement learning policy and a heuristic policy and a random policy. The simulation results verify the validity and performance of the proposed model. © 2022, The Author(s), under exclusive licence to Springer Science+Business Media, LLC, part of Springer Nature.",2022,Discrete event simulation E-learning Learning systems Software agents Agent based Agent-based discrete-event Behavior-based Digital twin workshop Discrete events Discrete-event simulations Physical simulation Real-time data Reinforcement learnings Workshop model Reinforcement learningAgent-based Discrete-event Digital Twin Workshop Reinforcement learning,academic,"College of Mechanical Engineering, Zhejiang University of Technology, No. 288, Liuhe Road, Hangzhou, China; Shanghai Tobacco Group Co., Ltd, No. 717, Changyang Road, Shanghai, China",233,0.2222222222222222
A five-step approach to planning data-driven digital twins for discrete manufacturing systems,"A digital twin of a manufacturing system is a digital copy of the physical manufacturing system that consists of various digital models at multiple scales and levels. Digital twins that communicate with their physical counterparts throughout their lifecycle are the basis for data-driven factories. The problem with developing digital models that form the digital twin is that they operate with large amounts of heterogeneous data. Since the models represent simplifications of the physical world, managing the heterogeneous data and linking the data with the digital twin represent a challenge. The paper proposes a five-step approach to planning data-driven digital twins of manufacturing systems and their processes. The approach guides the user from breaking down the system and the underlying building blocks of the processes into four groups. The development of a digital model includes predefined necessary parameters that allow a digital model connecting with a real manufacturing system. The connection enables the control of the real manufacturing system and allows the creation of the digital twin. Presentation and visualization of a system functioning based on the digital twin for different participants is presented in the last step. The suitability of the approach for the industrial environment is illustrated using the case study of planning the digital twin for material logistics of the manufacturing system. © 2021 by the authors. Licensee MDPI, Basel, Switzerland.",2021,Data-driven factory Digital model Digital twin Discrete-event simulation Modelling,academic,"Faculty of Mechanical Engineering, University of Ljubljana, Ljubljana, 1000, Slovenia",233,0.3333333333333333
Building Discrete-Event Simulation for Digital Twin Applications in Production Systems,"Digital equivalence is the main objective of Digital Twin (DT)s, and simulation is an integral part. DTs reach beyond traditional simulation with the help of real-time synchronization through Industrial Internet of Things (IIoT) technologies. Simulation supports off-line experimentations and planning, while DTs offer synchronous execution and modification. DTs help to understand 'what may happen'. Also, they present 'what is happening' and its management methodologies. In this paper, we present building aspects and an integration approach for a Digital Twin based Discrete-Event Simulation model. Our approach utilizes a data-driven agent-based simulation within a DT framework. It presents an integration layer that provides two essential features: reconfiguration and state initialization. It gives simulation models configurability and integrity that are required for operating within a DT. Our proposed approach is presented through a use case of a semiconductor manufacturing system. The proposed integration layer extends the usability of current Discrete-Event Simulation (DES) for a DT within a Cyber-Physical Production System. © 2021 IEEE.",2021,Industry 4.0 Integration Semiconductor device manufacture Data driven Discrete-event simulation model Discrete-event simulations Integral part Integration approach Internet of things technologies Management methodologies Production system Real- time Time synchronization Discrete event simulationDigital Twin Discrete-event simulation Industry 4.0,academic,"Mathematics And Industrial Engineering Ecole Polytechnique De Montreál, Montreál, Canada",233,0.21621621621621623
A discrete event simulation based approach for digital twin implementation,"Nowadays, manufacturing companies need to improve their production monitoring and prediction to be more flexible and re-configurable. To do so, the digitization of the manufacturing environment is a very critical issue. This paper proposes an approach to develop digital twins in this environment. Digital twins are virtual systems, real time connected with their physical counterpart, which replicate exactly their behaviour. Discrete event simulation models, connected in real-time with their real system counterparts, are developed in this work. Two industrial use cases are analysed, to show the benefits that this promising technology can bring to the manufacturing industry. © 2021 The Authors. This is an open access article under the CC BY-NC-ND license (http://creativecommons.org/licenses/by-nc-nd/4.0)",2021,Discrete event simulation Manufacture Capacity and performance evaluation Digitisation Discrete-event simulations Manufacturing companies Manufacturing environments Performances evaluation Production monitoring Production prediction Real-time control Simulation based approaches Real time controlCapacity and Performance Evaluation Discrete-event Simulation Real-time Control,academic,"Comau S.p.A., Via Rivalta 30, Grugliasco (TO), Italy; Department of Management and Production Engineering, Politecnico di Torino, Corso Duca degli Abruzzi 24, Torino, Italy",233,0.3055555555555556
Continuous adaption through real data analysis turn simulation models into digital twins,"Digital twins of production systems enable new forms of production control, flexibility and continuous improvement. While off-the-shelf software for discrete-event simulation permits the fast implementation of rough simulation models with sufficient accuracy for project-based analysis, they lack the precision and generality of a digital twin. This paper presents an approach to close the gap between model and reality by continuous and iterative updates enabled by connecting the simulation model to IT systems and smart data analysis. However, handling different databases requires a generative and flexible modelling approach as well as suitable algorithms for probability distribution estimation and control logic identification. The presented approach was validated at a real world example from the automotive industry where an average deviation of output to reality per week of 0.1% was achieved, proving the effectiveness of the approach. © 2021 Elsevier B.V.. All rights reserved.",2021,Automotive industry Computer software Discrete event simulation Information analysis Iterative methods Probability distributions Production control Contiunuous improvement process Control improvements Discrete-event simulations Flexibility Material Flow New forms Process mining Production system Real data analysis Simulation model Data handlingContiunuous improvement process Data analysis Digital Twin Discrete-event simulation Flexibility Material Flow Process Mining,academic,"Wbk Institute of Production Science, Karlsruhe Institute of Technology, Kaiserstr. 12, Karlsruhe, 76131, Germany",233,0.29411764705882354
A digital twin framework for the simulation and optimization of production systems,"Industry 4.0 has raised the expectations on productivity, automation, and resource efficiency of manufacturing systems. This paper proposes a digital twin framework for the simulation and optimization of production lines and cells that can be used in the design and operation stages. The framework is supported by an architecture that connects manufacturing and machine tool data (digital shadow), the discrete event simulation model and the optimization engine, allowing for a variety of functionalities to plan and manage the production system. A use case is provided to demonstrate this framework, implemented in an automated line for the manufacturing of railway axles. © 2021 The Author(s).",2021,Discrete event simulation Information management Manufacture Railroad transportation Design and operations Design stage Discrete-event simulations Optimisations Production cells Production line Production system Resource efficiencies Servitization Simulation and optimization Machine toolsdigital twin discrete-event simulation monitoring optimization servitization,academic,"IDEKO, Member of Basque Research and Technology Alliance, Arriaga 2, Gipuzkoa, Elgoibar, 20870, Spain; Electronics and Computer Science, Mondragon Unibertsitatea, Gipuzkoa, Mondragon, Spain",233,0.2777777777777778
Hierarchical Aggregation/Disaggregation for Adaptive Abstraction-Level Conversion in Digital Twin-Based Smart Semiconductor Manufacturing,"In smart manufacturing, engineers typically analyze unexpected real-time problems using digitally cloned discrete-event (DE) models for wafer fabrication. To achieve a faster response to problems, it is essential to increase the speed of DE simulations because making optimal decisions for addressing the issues requires repeated simulations. This paper presents a hierarchical aggregation/disaggregation (A/D) method that substitutes complex event-driven operations with two-layered abstracted models-single-group mean-delay models (SMDMs) and multi-group MDMs (MMDMs)-to gain simulation speedup. The SMDM dynamically abstracts a DE machine group's behaviors into observed mean-delay constants when the group converges into a steady state. The MMDM fast-forwards the input lots by bypassing the chained processing steps in multiple steady-state groups until it schedules the lots for delivery to subsequent unsteady groups after corresponding multi-step mean delays. The key component, the abstraction-level converter (ALC), has the roles of MMDM allocation, deallocation, extension, splitting, and controls the flow of each group's input lot by deciding the destination DE model, SMDM, and MMDMs. To maximize the reuse of previously computed multi-step delays for the dynamically changing MMDMs, we propose an efficient method to manage the delays using two-level caches. Each steady-state group's ALC performs statistical testing to detect the lot-arrival change to reactivate the DE model. However, fast-forwarding (FF) results in incorrect test results of the bypassed group's ALCs due to the missed observations of the bypassed lots. Thus, we propose a method for test-sample reinitialization that considers the bypassing. Moreover, since a bypassed group's unexpected divergence can change the multi-step delays of previously scheduled events, a method for examination of FF history is designed to trace the highly influenced events. This proposed method has been applied in various case studies, and it has achieved speedups of up to about 5.9 times, with 2.5 to 8.3% degradation in accuracy.  © 2013 IEEE.",2021,Cloning Digital twin Semiconductor device manufacture Hierarchical aggregation Missed observations Multiple steady state Real-time problems Semiconductor manufacturing Simulation speed-up Smart manufacturing Statistical testing Discrete event simulationAbstraction-level conversion aggregation/disaggregation discrete-event modeling smart manufacturing wafer fabrication,academic,"School of Computer Science and Engineering, Nanyang Technological University, Singapore, 639798, Singapore; School of Electronics Engineering, Kyungpook National University, Daegu, 41566, South Korea",233,0.23529411764705882
Developing digital twins for production enterprises,"This article presents a new approach to developing digital twins of production companies with the use of simulation methods. It describes the concept of digital twins as an integrated system that aggregates simulation models, databases and intelligent software modules of the class of genetic optimization algorithms, subsystems of data mining, etc. The article presents examples of simulation models of different production companies, in particular, a typical assembly plant and a typical oil production enterprise. The first company carries out activities to assembly products from individual components with its own individual characteristics. To describe the behavior of such an enterprise, methods of agent and discrete-event modeling are used. The second enterprise produces raw carbohydrate materials at existing fields with individual characteristics. The integrated simulation models thus developed are integrated with a subject-oriented database and optimization modules that facilitate providing a control of the technological and resource characteristics of the respective production enterprises. The development of these models was performed using AnyLogic and Powersim simulation systems that support agent-based modeling and system dynamics methods. We demonstrate here the possibility of creating 'digital twins' for production companies using modern simulation tools. © 2010 Sociedad Mexicana de Psicologia. All rights reserved.",2019,Agent-based modeling Digital economy Digital twins Discrete-event simulation Production companies System dynamics,academic,"Central Economics and Mathematics Institute, Russian Academy of Sciences, 47, Nakhimovsky Prospect, Moscow, 117418, Russian Federation",233,0.25
A Simulation Based Approach to Digital Twin’s Interoperability Verification & Validation,"The digital twins of production systems are one of the pillars of the Indus-try of the Future. Despite numerous on-going research and development initiatives the verification and validation of the digital twin remains a major scientific obstacle. This work proposes a simulation-based approach to achieve this goal: support Digital Twin verification and validation through the definition of a dedicated framework. A simulation model is used in place of the real-world system for ensuring the digital twin behaves as expected and for assessing its proper interoperability with the system to be twinned with. Then the simulation model is replaced by the real-world sys-tem, to interoperate with the verified and validated digital twin. With such an approach, the interoperability middleware, i.e. the IoT between the sys-tem and its digital twin can also be modeled, simulated, verified and vali-dated. Consequently, an optimized solution can be built for an entire value chain, from the system to its digital twin and conversely. © 2022 CEUR-WS. All rights reserved.",2022,Middleware Optimized solutions Production system Real-world Real-world system Research and development Simulation Simulation based approaches Simulation model Value chains Verification-and-validation InteroperabilityDigital twin simulation verification and validation,academic,"University of Bordeaux, IMS UMR 5218, 351 Crs de la Libération, Talence, 33400, France",237,0.23076923076923078
