papers_name,papers_abstract,papers_year,papers_keywords,papers_type,papers_country,papers_cluster_number,papers_keywords_score
Efficient generation of a digital twin using object detection for data acquisition and XML-interface for model creation,"A Digital Twin can be utilized for prospective planning, analysis of existing systems or process-parallel monitoring. In all cases, the Digital Twin offers manufacturing companies room for improvement in production processes leading to cost savings. However, many companies do not apply the technology, because the generation of a Digital Twin is cost-, time- and resource-intensive and IT expertise is required. This paper presents an approach for generating a Digital Twin efficiently, in which the obstacles will be overcome by using fast scans of the shop floor and subsequent object recognition. The focus here is on creating a simulation model. © 2020 The Authors.",2020,Costs Data acquisition Digital twin Object detection Object recognition Cost saving Existing systems IT expertise Manufacturing companies Model creation Production process Shop floor Simulation model ManufactureDigital twin Manufacturing systems Simulation,academic,"Institute of Production Engineering and Machine Tools, Leibniz University Hannover, An der Universität 2, Garbsen, 30823, Germany; PROSTEP AG, Dolivostraße11, Darmstadt, 64293, Germany",164,0.3333333333333333
An Integrated Platform for Multi-Model Digital Twins,"The notion of Digital Twin is known as a means to access otherwise dispersed lifecycle data of industrial devices, and enabling advanced reasoning on top of the data via various kinds of models (e.g. machine learning, simulation). Despite many studies on digital twins, there is still a need for common architectures, platforms and information meta-modelling that enable defining various lifecycle data in a harmonized way, as well as integrating the information with machine learning and simulation models; a gap that is filled by this paper. Our approach for the integration of various digital twin models addresses three known technical debt in machine learning systems: data pipeline jungle, undeclared/unstable data dependencies and undeclared consumers. Adopting such an integrated digital twin platform can reduce the required time and effort to develop and maintain digital twin-based solutions, as well as laying a foundation to support a variety of digital twin-based use cases. © 2021 ACM.",2021,Computer architecture Digital devices Life cycle Machine learning Simulation platform Architecture platforms Cloud-based architectures Common architecture Industrial devices Integrated platform Machine learning models Meta model Metamodeling Models integration Multi-modelling Data integrationCloud-based architecture Data integration Digital twin Model integration,academic,"Corporate Research Center, ABB, Ladenburg, Germany; Corporate Research Center, ABB, Västerås, Sweden",165,0.2631578947368421
'Digital Twins' for Highly Customized Electronic Devices-Case Study on a Rework Operation,"The ongoing changes in manufacturing require that new information models for industrial computer systems be developed and applied. This paper describes a concept for the material model as a 'digital twin' for producing highly customised, smart electronic devices. The scope of the research is the transformation of the models that are typical for the currently used automation pyramid approach to Reference Architecture Models for Industry 4.0 (RAMI4.0). The ISA95 standard is used as the modelling tool and Open Production Connectivity Unified Architecture (OPC UA) as the communication middleware. The presented use case focuses on a rework operation that is performed during the short series production of highly customised electronic devices that are produced by the Aiut company. The paper focuses on the transformation from the static architecture of Manufacturing Execution Systems to flexible and dynamic information models. © 2013 IEEE.",2019,Computer architecture Digital devices Information theory Middleware Thermoelectric equipment Common information model Communication middleware Flexible manufacturing Industrial computer systems Manufacturing Execution System Reference architecture Static architecture Unified architecture Computer integrated manufacturingCommon information model (computing) computer integrated manufacturing flexible manufacturing systemsintelligent manufacturing systems,academic,"Institute of Informatics, Silesian University of Technology, Gliwice, 44-100, Poland; Automation Department, AIUT Sp. Z O.o., Gliwice, 44-109, Poland; Department of Electrical Engineering, Western Norway University of Applied Sciences, Forde, 6812, Norway",165,0.2619047619047619
"Digital twin of mRNA-based SARS-COVID-19 vaccine manufacturing towards autonomous operation for improvements in speed, scale, robustness, flexibility and real-time release testing","Supplying SARS-COVID-19 vaccines in quantities to meet global demand has a bottleneck in manufacturing capacity. Assessment of existing mRNA (messenger ribonucleic acid) vaccine processing shows the need for digital twins enabled by process analytical technology approaches to improve process transfers for manufacturing capacity multiplication, reduction of out-of-specification batch failures, qualified personnel training for faster validation and efficient operation, optimal utilization of scarce buffers and chemicals, and faster product release. A digital twin of the total pDNA (plasmid deoxyribonucleic acid) to mRNA process is proposed. In addition, a first feasibility of multisensory process analytical technology (PAT) is shown. Process performance characteristics are derived as results and evaluated regarding manufacturing technology bottlenecks. Potential improvements could be pointed out such as dilution reduction in lysis, and potential reduction of necessary chromatography steps. 1 g pDNA may lead to about 30 g mRNA. This shifts the bottleneck towards the mRNA processing step, which points out co-transcriptional capping as a preferred option to reduce the number of purification steps. Purity demands are fulfilled by a combination of mixed-mode and reversed-phase chromatography as established unit operations on a higher industrial readiness level than e.g., precipitation and ethanol-chloroform extraction. As a final step, lyophilization was chosen for stability, storage and transportation logistics. Alternative process units like UF/DF (ultra-/diafiltration) integration would allow the adjustment of final concentration and buffer composition before lipid-nano particle (LNP) formulation. The complete digital twin is proposed for further validation in manufacturing scale and utilization in process optimization and manufacturing operations. The first PAT results should be followed by detailed investigation of different batches and processing steps in order to implement this strategy for process control and reliable, efficient operation. © 2021 by the authors. Licensee MDPI, Basel, Switzerland.",2021,Digital twin Manufacturing MRNA PDNA Process analytical technology SARS-COVID-19 Vaccines,academic,"Institute for Separation and Process Technology, Clausthal University of Technology, Leibnizstr. 15, Clausthal-Zellerfeld, 38678, Germany",174,0.2
Digital twin quality improvement for mines through standardization of attribute content for 3D GIS-based geotechnical modeling; [ПОВЫШЕНИЕ КАЧЕСТВА ЦИФРОВЫХ «ДВОЙНИКОВ» ГОРНОДОБЫВАЮЩИХ ПРЕДПРИЯТИЙ НА БАЗЕ СТАНДАРТИЗАЦИИ АТРИБУТИВНОГО НАПОЛНЕНИЯ ТЕХНОЛОГИЧЕСКИХ 3D-МОДЕЛЕЙ В ГГИС],"Currently, mining companies are increasingly implementing digitalization in their production. At the same time, it is worth noting that the role of standards in creating “digital mines” and “mines of the future” is difficult to overestimate. Digitalization and standardization are closely interrelated processes. The only correct way to integrate the devices, information systems and digital models used in mining enterprises is based primarily on technical standards and regulations, which in turn strengthen the Foundation for intelligent digital production in the industry. In order to ensure the compatibility of mining and geological, mining and technological and technical parameters, intelligent management systems and data analysis, as well as the interaction of various departments of mining enterprises with government services, it is necessary to create industry standards for digital production. This article highlights the main stages of the creating process a frame model of the excavation chamber in the GGIS, analyzes the standard set of attributes frame models of element’s the underground mining system solid mineral deposits (excavation chambers, treatment faces, technological units, panels, blocks, floors of preparatory workings, security pillars, etc.) in the GGIS and user attributes necessary for formalization of technological 3D models. The rules of attributive filling technological 3D models created in mining and geological information systems for standardization of digital production at an underground mine are proposed. The use of such regulations in the future makes it possible to carry out state analysis of 3D design models in an automated mode, and determines the transition to the use of regulatory and technical documentation in electronic form as part of digital “images” of mining enterprises. © 2020 Publishing house Mining book. All rights reserved.",2020,3D modeling in the mining industry Attributes of technological 3D models in GGIS Development of ore deposits’s georesources Digital “image” of a mining enterprise Mining and geological information systems (GGIS) Standardization of mining digital production,academic,"North Caucasian Institute of Mining and Metallurgy (State Technological University), Vladikavkaz, Russian Federation",195,0.2
A Novel Implementation Framework of Digital Twins for Intelligent Manufacturing Based on Container Technology and Cloud Manufacturing Services,"Many core technologies of Industry 4.0 have gained substantial advancement in recent years. Digital Twin (DT) has become the key technology and tool for manufacturing industries to realize intelligent cyber-physical integration and digital transformation by leveraging these technologies. Although there have been many DT-related works, there is no standard definition, unified framework, and implementation approach of DT until now. Widely developing DTs for the manufacturing industry is still challenging. Thus, this paper proposes a novel implementation framework of digital twins for intelligent manufacturing, denoted as IF-DTiM, which possesses several distinct merits to distinguish itself from previous works. First, IF-DTiM fully utilizes new-generation container technology so that DT-related applications and services can be packaged in a self-contained way, rapidly deployed, and robustly operated with the capabilities of failover, autoscaling, and load balancing. Second, it leverages existing intelligent cloud manufacturing services to realize the intelligence for DT externally in a scalable and plug-and-play manner instead of using traditional approaches to embed intelligence in DT. Third, IF-DTiM contains Product DT for products, Equipment DT (i.e., EQ DT) for equipment, and Process DT for production lines, which can generically fulfill the demands and scenarios to achieve intelligent manufacturing for various manufacturing industries. Testing results show that IF-DTiM can achieve remarkable performance in rapid deployment and real-time data exchanges of DT-related applications. Finally, we develop an example DTiM system for CNC machining based on IF-DTiM to demonstrate its efficacy and applicability in facilitating the manufacturing industry to build their DT systems. Note to Practitioners - Developing Digital Twin (DT) systems to realize intelligent manufacturing is challenging. The proposed IF-DTiM (Implementation Framework of Digital Twins for Intelligent Manufacturing) provides a novel container-technology and cloud-manufacturing-service-based systematic methodology for building DTiM. In this paper, we present the system architecture and several operational scenarios (e.g., how to create and use DTs) of IF-DTiM, together with the design of its core functional mechanisms (e.g., rapid deployment scheme for DT, real-time data exchange for DT, DT interface pattern, and general workflow architecture for DT). Also, an example DTiM system for CNC machining based on IF-DTiM is presented to facilitate the practitioners to adopt the designs and niches in IF-DTiM to build their desired DTiM systems.  © 2004-2012 IEEE.",2022,Computer aided manufacturing Electronic data interchange Industry 4.0 Cloud Manufacturing Cloud-computing Container technology. Core technology Implementation framework Intelligent Manufacturing Manufacturing industries Manufacturing service Many-core Software Containerscontainer technology digital twins Implementation framework intelligent manufacturing,academic,"Chinese Culture University, Department of Computer Science and Information Engineering, Taipei, 111396, Taiwan; Institute of Manufacturing Information and Systems, National Cheng Kung University, Tainan, 701401, Taiwan; National Cheng Kung University, Department of Computer Science and Information Engineering, Tainan, 701401, Taiwan; National Taichung University of Education, Department of Computer Science, Taichung, 40306, Taiwan",216,0.24242424242424243
Digital Twins for Enhanced Resilience: Aerospace Manufacturing Scenario,"European manufacturing industry faces a growing cyber-threat landscape which increasingly involves sophisticated nation-state- sponsored actors. Moreover, while the ongoing evolution towards more connected production environments generates significant benefits in productivity, it also creates more complex risk scenarios. In this work we show how Digital Twins enhance the resilience and improve the overall security posture of manufacturing industry, based on a highly critical scenario unfolding in the aerospace sector. © 2022, The Author(s), under exclusive license to Springer Nature Switzerland AG.",2022,Cybersecurity Risk perception Aerospace manufacturing Cybe resilience Cyber threats Distributed manufacturing European manufacturing Industry based Manufacturing industries Production environments Risks scenarios Unfoldings ManufactureCyber resilience Digital Twin Distributed manufacturing,academic,"Airbus Cybersecurity SAS, Elancourt, France; GECAD/ISEP, Porto, Portugal; IRT SystemX, Rennes, France",216,0.21428571428571427
Sustainable Manufacturing Digital Twins: A Review of Development and Application,"Sustainable manufacturing as a concept as well as the practices that are deployed are well established in the literature. Tools that guide the development of manufacturing to have less environmental impact are being deployed and documented. The power of digital technology to enable manufacturing systems to be more productive is well established and advances continue to be made. What is less well known is how digital technology can support the pursuit of sustainable manufacturing, especially using digital models, shadows and twins. Here a digital simulation model is configured to analyse, replicate and drive the real production respectively to improve resource productivity in the widest sense. This paper considers the literature and practice of such digital tools in manufacturing operations as well as across the lifecycle. Literature considered is mostly from 2018 onwards as this is the point at which digital twin empirical work emerges. Whilst the work on digital twins is advancing fast, the work on sustainable manufacturing is limited to energy and, to some extent, resource efficiency. Further when compared to documented practice, the academic field appears to be lagging depending on how the loose definition of digital twins in practice is interpreted. The paper concludes with potential avenues for further research on digital models, shadows and twins in the pursuit of sustainable manufacturing. © 2022, The Author(s), under exclusive license to Springer Nature Singapore Pte Ltd.",2022,Digital devices Environmental impact Industrial research Life cycle Development and applications Digital modeling Digital simulation models Digital technologies Eco-efficiency Literature reviews Power Resource productivity Sustainable manufacturing Sustainable manufacturing system Industry 4.0Digital twins Eco-efficiency Industry 4.0 Literature review Sustainable manufacturing systems,academic,"University of York Management School, York, United Kingdom",216,0.25
"Digital twins: Representation, Replication, Reality, and Relational (4Rs)","Digital twins hold promise for operational improvement for manufacturers. The use of digital twins in industry requires a significant change in manufacturing practices but is crucial to implementing smart manufacturing technologies and Industry 4.0 principles. Unfortunately, there is no consensus definition of a digital twin which leads to confusion about its essential features and distinction from product models and simulations. This research addresses the confusion surrounding digital twins by creating a generalized framework for creating a digital twin of any system, providing structure to improve communications about the digital twin, and aligning the digital twin's capabilities with its intended purpose. © 2021 Society of Manufacturing Engineers (SME)",2022,Essential features Framework Manufacturing industries Manufacturing practices Manufacturing technologies Model and simulation Operational improvements Product models Product simulation Smart manufacturing Industry 4.0Digital Twin Framework Industry 4.0 Manufacturing,academic,"Auburn University, Department of Industrial & Systems Engineering, 345 W. Magnolia Ave., Auburn, 36849, AL, United States",216,0.48148148148148145
Intelligent Manufacturing with Digital Twin,"The age of digital transformation will have a significant impact on industry and society. Designing, developing, and manufacturing products is more based on the influence of the fourth technological wave with its possibilities through digital transformation. The digital twin is commonly known as a key enabler for digital transformation at all scales - for large and small businesses, for organizations and individuals, globally and locally. The new challenges through digital transformation are seen as an opportunity to achieve higher levels of solutions to handle the different innovative technological methods with regard to quality in production in the manufacturing industry. Due to the complexity of intelligent manufacturing, an advanced and complex tool is required to (i) investigate, (ii) monitor, and (iii) simulate the intelligent manufacturing processes in real-time. The tool to achieve this goal is the digital twin, which works in parallel to sense, monitor, and control manufacturing devices and cyber-physical production systems across the manufacturing plant network infrastructure. The digital twin performs real-time optimization and evaluates the metrics of the execution of the intelligent manufacturing system. This paper introduces intelligent manufacturing and the digital twin as key enablers for the digital transformation in intelligent manufacturing. © 2021 IEEE.",2021,Complex networks Digital devices Digital twin Product design Digital transformation Intelligent Manufacturing Intelligent manufacturing system Manufacturing industries Manufacturing products Network infrastructure Real-time optimization Technological methods ManufactureDigital twins Intelligent manufacturing,academic,"Clausthal University of Technology (TUC), Germany; University of Nebraska-Lincoln, United States; Zhengzhou University, China",216,0.2413793103448276
Digital twin-based sustainable intelligent manufacturing: a review,"As the next-generation manufacturing system, intelligent manufacturing enables better quality, higher productivity, lower cost, and increased manufacturing flexibility. The concept of sustainability is receiving increasing attention, and sustainable manufacturing is evolving. The digital twin is an emerging technology used in intelligent manufacturing that can grasp the state of intelligent manufacturing systems in real-time and predict system failures. Sustainable intelligent manufacturing based on a digital twin has advantages in practical applications. To fully understand the intelligent manufacturing that provides the digital twin, this study reviews both technologies and discusses the sustainability of intelligent manufacturing. Firstly, the relevant content of intelligent manufacturing, including intelligent manufacturing equipment, systems, and services, is analyzed. In addition, the sustainability of intelligent manufacturing is discussed. Subsequently, a digital twin and its application are introduced along with the development of intelligent manufacturing based on the digital twin technology. Finally, combined with the current status, the future development direction of intelligent manufacturing is presented. © 2020, The Author(s).",2021,Advanced manufacturing Digital twin Industry 4.0 Intelligent manufacturing Sustainable manufacturing,academic,"Shanghai Key Laboratory of Intelligent Manufacturing and Robotics, School of Mechatronic Engineering and Automation, Shanghai University, Shanghai, 200444, China",216,0.4
Digital twins in product lifecycle for sustainability in manufacturing and maintenance,"A “digital twin” is a dynamic, digital replica of a technical object (e.g., a physical system, device, machine or production process) or a living organism. Using this type of solution has become an integral part of Industry 4.0, offering businesses tangible benefits, in addition to being particularly effective within the context of sustainable production and maintenance. The purpose of this paper is to present the results of research on the development of digital twins of technical objects, which involved data acquisition and their conversion into knowledge, the use of physical models to simulate tasks and processes, and the use of simulation models to improve the physical tasks and processes. In addition, monitoring processes and process parameters allow for the continued improvement of existing processes as regards intelligent eco-designing and planning and monitoring production processes while taking into account sustainable production and maintenance. © 2020 by the authors. Licensee MDPI, Basel, Switzerland.",2021,Computational intelligence Digital twins Maintenance Manufacturing Sustainability,academic,"Institute of Computer Science, Kazimierz Wielki University, Bydgoszcz, 85-064, Poland; Faculty of Mechanical Engineering, Poznań University of Technology, Poznań, 60-965, Poland",216,0.2857142857142857
Towards a digital twin for cloud manufacturing-case study,"Cloud manufacturing (CMfg) is a new manufacturing paradigm designed to enable manufacturing enterprise to share their resources and capabilities. Prior to any real-life change in the system, for CMfg it is important to anticipate and optimize the response of the system through simulation. Digital Twins (DT) is a simulation method for this paradigm that is different from existing simulation methods in two ways. It is a virtual copy of the system containing all the components and can connect to the controller in real time. The goal of this work is to develop a DT for an educational manufacturing cell. The educational manufacturing cell is a FESTO Reconfigurable Mechatronics System (RMS). The cell has four stations that uses pallets to transport the product on the conveyor belt and assembles a part of the product. The Siemens Process Simulate: TECNOMATIX, was used to create the DT of the system. The system is modeled in a CAD program and then imported into TECNOMATIX Process Simulate, where it is programmed to replicate the processes. Copyright © 2018 ASME",2018,Belt conveyors Computer aided manufacturing Flexible manufacturing systems Industry 4.0 Cloud Manufacturing Cloud manufacturing (CMfg) Digital Twins Manufacturing enterprise Manufacturing paradigm Mechatronics systems Resources and capabilities Siemens process Computer aided designCloud Manufacturing Digital Twins Industry 4.0 IOT,academic,"Kennesaw State University Marietta, GA, United States; Universidad Autónoma de San Luis Potosí Rioverde, San Luis Potosí, Mexico; Hacettepe University, Ankara, Turkey",216,0.21621621621621623
Conceptualizing Digital Twins,"Properly arranging models, data sources, and their relations to engineer digital twins is challenging. We propose a conceptual modeling framework for digital twins that captures the combined usage of heterogeneous models and their respective evolving data for the twinâs entire lifecycle.  © 1984-2012 IEEE.",2022,Biological systems Life cycle Unified Modeling Language Actual system Adaptation models Biological system modeling Conceptual model Conceptual modeling framework Condition Modeling type Modelling framework Predictive models Structure property Data structuresConceptual Modeling Framework Digital Twin Model Types,academic,"University of L'Aquila, Italy; École de technologie supérieure, Canada; University of Rennes 1, France; Eindhoven University of Technology, Netherlands; Johannes Kepler University Linz, Austria; University of Stuttgart, Germany",218,0.3611111111111111
