Name,Type,Material Type,Link,Keyword,Country,Year,Abstract,Responsible,Status,Created by,Created time
A digital twin concept for manufacturing systems,Academic,Conference Paper,https://www.scopus.com/inward/record.uri?eid=2-s2.0-85060365312&doi=10.1115%2fIMECE2018-87737&partnerID=40&md5=3afaa2ea54c09df4fde9afaf99321966,"Cyber Physical System, Cyber-physical system, Digital equivalents, Digital twin, Embedded systems, Flow control, Industrial 4.0, Industrial manufacturing, Manufacture, Optimization, Physical resources, Real time response, Smart manufacturing, Virtual resource, virtual reality","China, Mexico, United States",2018,"With the developments and applications of the advanced information technologies such as cloud computing, internet of thing, artificial intelligence and virtual reality, industry 4.0 and smart manufacturing era are coming. In this respect, one of the specific challenges is to achieve a connection of physical resources on the shop floor with virtual resources, for real-time response, real time process optimization, and simulation, which is merged by big data problem. In this respect, Digital Twins (DT) concept is introduced as a key technology, which includes physical resources, virtual resources, service system, and digital twin data. DT considers current condition of physical resource and prediction of future events to make a responsive decision. However, due to the complexity of building a digital equivalent in virtual space to its physical counterpart, very little applications have been developed with this purpose, especially in the industrial manufacturing area. Therefore, the types of data and technology required to build the DT for a manufacturing system are presented in this work, trying to develop a framework of DT based manufacturing system, which is supported by the virtual reality for virtualization of physical resources. Copyright © 2018 ASME",,Not started,Alex,"October 25, 2022 6:56 PM"
Digital Twin-driven approach towards manufacturing processes support,Academic,Conference Paper,https://www.scopus.com/inward/record.uri?eid=2-s2.0-85134743994&doi=10.1088%2f1742-6596%2f2198%2f1%2f012007&partnerID=40&md5=64e73ba1523823f2282d4247f031aa0d,"Analysis of various, Data and information, Decision making, Decisions makings, Digital modeling, Digitisation, Industrial revolutions, Innovation models, Manufacture, Manufacturing process, Process support, Production process",Poland,2022,"Modern systems supporting production processes are undergoing significant changes, which involve challenges related to the digitization of processes. Decision making is becoming more and more dependent on the analysis of various types of data and information from the production process. The 4th Industrial Revolution forces the transition towards new technologies, innovation and digital models also in manufacturing operations. One of the phenomena of Industry 4.0 is Digital Twin, whereby it is possible to analyze and simulate real-time different production variants from the real environment without directly interfering with the actual production process. Thanks to the use of Digital Twin, it is possible to optimize manufacturing procedures, detect physical problems faster and make a decision about a process change with smaller risks to achieve a new higher level of productivity. This paper will introduce the theoretical aspects connected with Digital Twin-driven approach in smart manufacturing and will emphasize its potential towards the application of new-generation information technologies in industry and manufacturing. The systematic literature research will be focused on the analysis of different application areas of Digital Twin in the modern industry. This paper will specify and highlight how manufacturing processes can benefit from the use of the Digital Twin concept. © Published under licence by IOP Publishing Ltd.",,Not started,Alex,"October 25, 2022 6:56 PM"
A digital twin-based approach for multi-objective optimization of short-term production planning,Academic,Conference Paper,https://www.scopus.com/inward/record.uri?eid=2-s2.0-85120684598&doi=10.1016%2fj.ifacol.2021.08.077&partnerID=40&md5=fc5c42847bd457e49f21bfa005cb25ac,"Artificial intelligence, Decision support systems, Intelligent decision support system in manufacturing, Intelligent decision support systems in manufacturing, Intelligent decision-support systems, Intelligent manufacturing system, Intelligent manufacturing systems, Manufacture, Manufacturing operations, Modeling of manufacturing operation, Modeling of manufacturing operations, Multi-objective optimization, Multi-objectives optimization, Multi-products, Multiobjective optimization, Planning, Product production, Production Planning, Production control, Production planning and control","Italy, Spain, Sweden",2021,"Short-term multi-product production planning strongly depends on manifold considerations which can be related to backlog production, product-type prioritization, machine capacity, and set-ups. Different manufacturing systems conditions may lead to different objectives. In this context, it is rather difficult to define a-priori optimal production plans. This paper presents an effective approach for short-term production planning of multi-product systems based on the integration of a Digital Twin and a multi-objective optimization method. The proposed approach has been implemented in a real industrial case of the railway sector. Numerical results show that useful insights can be inferred from the proposed methodology. © 2021 The Authors. This is an open access article under the CC BY-NC-ND license (http://creativecommons.org/licenses/by-nc-nd/4.0)",,Not started,Alex,"October 25, 2022 6:56 PM"
Dynamic production scheduling of digital twin job-shop based on edge computing,Academic,Article,https://www.scopus.com/inward/record.uri?eid=2-s2.0-85102646457&doi=10.6688%2fJISE.202101_37%281%29.0007&partnerID=40&md5=4b1f5e26883e20f43b0dada8978eb18d,"Business management layer, Current production, Data collection model, Data mining, Digital twin, Dynamic scheduling, Edge computing, Industrial research, Information spaces, Job shop scheduling, Job-shop scheduling, Manufacture, Manufacturing process, Production control, Real time interactions, Scheduling, Scheduling knowledge",China,2021,"The current production scheduling models cannot effectively enable the real-time interaction between information space and physical space. To dynamically schedule twin digital job-shop, this paper attempts to realize the dynamic scheduling of digital twin job-shop (DTJ) based on edge computing. First, the architecture of the DTJ was established by adding the digital twin between the business management layer and the operation execution layer of the traditional job-shop. On this basis, the DTJ was fully modelled, and the manufacturing process was monitored, analyzed and managed remoted by edge computing. To realize dynamic scheduling, a DTJ scheduling model was established through data mining. The model consists of two parts: a data collection model and a multi-scheduling knowledge model. Finally, the proposed DTJ scheduling model was verified through simulation on an actual job-shop. The research results shed new light on the optimization of manufacturing process in various types of job-shops. © 2021 Institute of Information Science. All rights reserved.",,Not started,Alex,"October 25, 2022 6:56 PM"
Method of digital twin logic model oriented to production line simulation [面向生产线仿真的数字孪生逻辑模型构建方法],Academic,Article,https://www.scopus.com/inward/record.uri?eid=2-s2.0-85126474593&doi=10.13196%2fj.cims.2022.02.010&partnerID=40&md5=0b90633ec4d4effd9b3bf7b9fdd30d88,"Computer circuits, Digital twin logic model, Finite state mechanism, Finite-state, Logic models, Model construction, Production behavior, Production behaviors, Production designs, Production line, Production line simulation, Simulation rule","China, Hong Kong",2022,"Production line simulation is a prerequisite to ensure the correctness, rationality and effectiveness of a plan of the production design, and the simulation of the correctness of the production line logic is the most critical. To realize the production line simulation technology based on the digital twin, a method of digital twin logic model construction oriented to the production line simulation was proposed. First of all, the composition architecture of the production line simulation system was proposed. Then, the construction method of the digital twin logical model was explained from the four dimensions of geometry, physics, production behavior, and simulation rules. The definition methods of geometric attributes and physical attributes were introduced in detail, and the production behavior was defined by finite state machine and three types of simulation rules, which include messaging rules, synchronous advance rules and mutual exclusion priority rules. The production line logic simulation prototype system was developed based on the method of model construction finally, and the effectiveness of the modeling method was verified through the simulation of the production line example. © 2022, Editorial Department of CIMS. All right reserved.",,Not started,Alex,"October 25, 2022 6:56 PM"
"Digital twin-based designing of the configuration, motion, control, and optimization model of a flow-type smart manufacturing system",Academic,Article,https://www.scopus.com/inward/record.uri?eid=2-s2.0-85083837378&doi=10.1016%2fj.jmsy.2020.04.012&partnerID=40&md5=4fa3da9a8bcfb9f27457e0415d29776b,"Computer aided software engineering, Configuration designs, Cost of manufacturing, Cyber-physical systems, Design architecture, Design deficiencies, Digital twin, Enabling technologies, Flow control, Glass industry, Industry 4.0, Iterative methods, Manufacture, Manufacturing system design, Optimization modeling, Physical equipment, Smart manufacturing, System reconfiguration, Traction (friction)","China, Hong Kong",2021,"Digital twins can achieve hardware-in-the-loop simulation of both physical equipment and cyber model, which could be used to avoid the considerable cost of manufacturing system reconfiguration if the design deficiencies are found in the deployment process of the traditional irreversible design approach. Based on the digital twin technology, a quad-play CMCO (i.e., Configuration design-Motion planning-Control development-Optimization decoupling) design architecture is put forward for the design of the flow-type smart manufacturing system in the Industry 4.0 context. The iteration logic of the CMCO design model is expounded. Two key enabling technologies for enabling the customized and software-defined design of flow-type smart manufacturing systems are presented, including the generalized encapsulation of the quad-play CMCO model and the digital twin technique. A prototype of a digital twin-based manufacturing system design platform, named Digital Twin System, is presented based on the CMCO model. The digital twin-based design platform is verified with a case study of the hollow glass smart manufacturing system. The result shows that the Digital Twin System-based design approach is feasible and efficient. © 2020 The Society of Manufacturing Engineers",,Not started,Alex,"October 25, 2022 6:56 PM"
Digital Twins-Based Production Line Design and Simulation Optimization of Large-Scale Mobile Phone Assembly Workshop,Academic,Article,https://www.scopus.com/inward/record.uri?eid=2-s2.0-85130568486&doi=10.3390%2fmachines10050367&partnerID=40&md5=7d9503b69b6f7103a2740ecfc6edf4fc,"Digital twins, Simulation optimization, hybrid workshop, mobile phone assembly line, production line design",China,2022,"The mobile phone is a typical 3C electronic product characterized by frequent replacement, multiple product specifications, high flexibility, high-frequency production line switching, and urgent delivery time during production. Therefore, the optimized design of the mobile phone production workshop is crucial. This paper takes the assembly process of a specific type of mobile phone assembly as the research object and adopts the heuristic balance method to combine the production procedures. Moreover, it considers the automation degree of the process and the demand for production line rhythm to carry out station division and working hours design for the assembly process. The advantages and disadvantages of the plug-and-play production line and unit production line architecture are integrated, aiming at the production line’s construction cost and unit area capacity. A hybrid workshop with a mixed combination of two types of production lines is designed and an optimization model of hybrid workshop design is established. The semi-physical simulation technology of digital twins is utilized to verify the proposed design scheme to achieve the balance optimization of the production line, improve production efficiency, and reduce production costs. This work provides a technical scheme for designing and optimizing large-scale mobile phone assembly workshops with multi-batch and high-frequency production changes. © 2022 by the authors. Licensee MDPI, Basel, Switzerland.",,Not started,Alex,"October 25, 2022 6:56 PM"
A Surrogate Model to Predict Production Performance in Digital Twin-Based Smart Manufacturing,Academic,Article,https://www.scopus.com/inward/record.uri?eid=2-s2.0-85127420644&doi=10.1115%2f1.4053038&partnerID=40&md5=f6cf5b70e39e95a6e0bab44ec6a7f05c,"Digital twin, Engineering informatics, Flow control, Forecasting, Information management, Input parameter, Manufacture, Manufacturing planning, Multivariate adaptive regression spline, Multivariate adaptive regression splines, Planning, Production Planning, Production control, Production order, Production performance, Production system, Scheduling, Smart manufacturing, Surrogate model, Surrogate modeling",Singapore,2022,"With the dynamic arrival of production orders and unforeseen changes in shop-floor conditions within a production system, production scheduling presents a challenge for manufacturing firms to ensure production demands are met with high productivity and low operating cost. Before a production schedule is generated to process the incoming production orders, production planning is performed. Given the large number of input parameters involved in the production planning, it poses the challenge on how to systematically and accurately predict and evaluate production performance. Hence, it is important to understand the interactions of the input parameters between the production planning and the scheduling. This is to ensure that the production planning and the scheduling are coordinated and can be performed to achieve optimal production performance such as minimizing cost effectively and efficiently. Digital twin presents an opportunity to mirror the real-time production status and analyze the input parameters affecting the production performance in smart manufacturing. In this paper, we propose an approach to develop a surrogate model to predict the production performance using input parameters from a production plan using the capabilities of real-time synchronization of production data in digital twin. Multivariate adaptive regression spline (MARS) is applied to construct a surrogate model based on three categories of input parameters, i.e., current production system load, machine-based and product-based parameters. An industrial case study involving a wafer fabrication production is used to develop the surrogate model based on a random sampling of varying numbers of training data set. The proposed MARS model shows a high correlation coefficient and a large reduction in the number of input parameters for both linear and nonlinear cases with relation to three performances, namely flowtime, tardiness, and machine utilization. Copyright © 2021 by ASME.",,Not started,Alex,"October 25, 2022 6:56 PM"
Paradigm shift in composite fan blade manufacturing using process digital twins,Academic,Conference Paper,https://www.scopus.com/inward/record.uri?eid=2-s2.0-85118778484&partnerID=40&md5=d1293e187313ebcf95ce03001df96d2a,"Adhesive metals, Adhesives, Curing, Fan blades, Manufacture, Manufacturing paradigm, Material variation, Materials and process, Paradigm shifts, Physical behaviors, Pressure vessels, Process Variation, Production quality, Real- time",United States,2021,"Process Digital Twin (PDT) technology is changing the manufacturing paradigm from reactively using data to proactively managing production quality. By predicting quality results in real time a PDT can adjust controllable inputs to overcome inherent material and process variations. In our case, the goal was to improve two high value processes: composite fan blade curing and adhesive metal bonding. Our digital twins used process experts' knowledge to capture physical behavior such as thermal response, cure kinetics, and rheometrics. Specialized algorithms then extracted Features for Quality (FFQ) from this physical behavior. Quality models finally predicted the probability of making a good part. After construction, the PDT was embedded into the manufacturing process. In our case, a production associate plans a cure process by using a web based interface and inputs including material properties, part types, outtime, tooling features and autoclave characteristics. If the yield target is not met, then an optimizer suggests changes in the controllable inputs such as autoclave location or cure recipe. This optimization ensures stable, high yield production. Our team has successfully developed and implemented process digital twins for two important processes: composite fan blade curing and adhesive bonding of metal to the composite blade. © 2021 Soc. for the Advancement of Material and Process Engineering. All rights reserved.",,Not started,Alex,"October 25, 2022 6:56 PM"
The projection of cyber and physical systems digital twins in the stage of production technological preparation of the Industry 4.0 smart factories,Academic,Conference Paper,https://www.scopus.com/inward/record.uri?eid=2-s2.0-85068697438&doi=10.1088%2f1757-899X%2f537%2f3%2f032009&partnerID=40&md5=ca3560547a1dc820648432b75ea3107d,"Automation, Digital factories, Digital production, Industry 4.0, Information resource, Physical systems, Production preparation, Project activities, System projection, Virtual components",Russian Federation,2019,The task is to create a cyber and physical system digital twin. Cyber and physical systems digital twins are components of the Industry 4.0 smart factories and is done with cloud services (resources) of digital production. The projection of cyber and physical systems digital twins is done in the stage of new type item technological production preparation (putting the item into production). If this is a wide cyber and physical system its digital twin is created in the digital factory and is part of cyber and physical system supply. The projection of digital twin must be done in connection with the physical part of this system projection. There is a scheme how to project the physical part of cyber and physical system. There is also a scheme how to project a virtual component of cyber and physical system (digital twin). The scheme base for the virtual component is the control program (information resource) and a set of clouds to automatize the project activity. © Published under licence by IOP Publishing Ltd.,,Not started,Alex,"October 25, 2022 6:56 PM"
Digital twin-based opti-state control method for a synchronized production operation system,Academic,Article,https://www.scopus.com/inward/record.uri?eid=2-s2.0-85075263269&doi=10.1016%2fj.rcim.2019.101892&partnerID=40&md5=ad1421b272c04b45d435bb5a959f61b0,"Decision making, Digital twin, Optimal State, Resilient Control, Synchronization, Synchronized Control, Uncertainties","China, Hong Kong, Sweden",2020,"The intelligent manufacturing strategy and customer demand have mutually promoted each other. Also, the production mode is shifting towards customized production, and more rental resources or services are introduced to the production system, therefore, the systems are becoming more complex. Compared with traditional production systems, such systems have some new features, this work calls this type of system as a synchronized production operation system (SPOS). Under such circumstances, production systems are influenced by more frequent uncertainties, and the planning-based production decision and control approach is no longer applicable. The opti-state control (OsC) method is proposed to help SPOS keep in an optimal state when uncertainties affect the system. Besides, a digital twin-based control framework (DTCF) is designed for getting the full element information needed for decision making. Based on the comprehensive information of the production system obtained by the DTCF, the OsC method is introduced to the virtual control layer to formulate the optimal target guiding the path of the system in real time through the dynamic matching mechanism (qualitative perspective). Then multi-stage synchronized control with analysis target cascading (ATC) method is used to get the local optimal state decisions (quantitative perspective). From both qualitative and quantitative aspects to ensure the system is under an optimal target path for optimal operation procedure. At last, a case study in a large-size paint making company in China is used to validate the effectiveness of the approach. © 2019 Elsevier Ltd",,Not started,Alex,"October 25, 2022 6:56 PM"
Digital Twins for the built environment: learning from conceptual and process models in manufacturing,Academic,Article,https://www.scopus.com/inward/record.uri?eid=2-s2.0-85107992986&doi=10.1016%2fj.aei.2021.101332&partnerID=40&md5=bfb52de345b4c1052be6f89bd76e59fb,"Academic publications, Architectural design, BIM, Building Information Modelling, Communication models, Conceptual Models, Cyber-physical systems, Cyber-physical systems (CPS), Digital twin, E-learning, Embedded systems, Engineering education, Industrial research, Information theory, Manufacture, Maturity Models, Process Models, Product life managements, Research frameworks, Service-based model, System architectures",United Kingdom,2021,"The overall aim of this paper is to contribute to a better understanding of the Digital Twin (DT) paradigm in the built environment by drawing inspiration from existing DT research in manufacturing. The DT is a Product Life Management information construct that has migrated to the built environment while research on the subject has grown intensely in recent years. Common to early research phases, DT research in the built environment has developed organically, setting the basis for mature definitions and robust research frameworks. As DT research in manufacturing is the most developed, this paper seeks to advance the understanding of DTs in the built environment by analysing how the DT systems reported in manufacturing literature are structured and how they function. Firstly, this paper presents a thorough review and a comparison of DT, cyber-physical systems (CPS), and building information modelling (BIM). Then, the results of the review and categorisation of DT structural and functional descriptions are presented. Fifty-four academic publications and industry reports were reviewed, and their structural and functional descriptions were analysed in detail. Three types of structural models (i.e. conceptual models, system architectures, and data models) and three types of functional models (process and communication models) were identified. DT maturity models were reviewed as well. From the reviewed descriptions, four categories of DT conceptual models (prototypical, model-based, interface-oriented, and service-based) and six categories of DT process models (DT creation, DT synchronisation, asset monitoring, prognosis and simulation, optimal operations, and optimised design) were defined and its applicability to the AECO assessed. While model-based and service-based models are the most applicable to the built environment, amendments are still required. Prognosis and simulation process models are the most widely applicable for AECO use-cases. The main contribution to knowledge of this study is that it compiles the DT's structural and functional descriptions used in manufacturing and it provides the basis to develop DT conceptual and process models specific to requirements of the built environment sectors. © 2021",,Not started,Alex,"October 25, 2022 6:56 PM"
