Name,Type,Material Type,Link,Keyword,Country,Year,Abstract,Responsible,Status,Created by,Created time
Digital twin and its potential application exploration,Academic,Article,https://www.scopus.com/inward/record.uri?eid=2-s2.0-85046337978&doi=10.13196%2fj.cims.2018.01.001&partnerID=40&md5=00e1d7b27b16a036104917007f1016f8,"Application principle, Digital twin, Digital twin application, Digital twin model, Dimensional structures, Engineering practices, Enterprise applications, Flow control, Manufacture, Present situation, Smart manufacturing, Theoretical research, Typical application, virtual reality",China,2018,"Digital twin, as a technology of integrating multi-physics, multi-scale and multidisciplinary attributes, characterized by real-time synchronization, faithful mapping and high fidelity, could realize interaction and integration between physical space and virtual world. At present, digital twin had received great attention from academics and enterprises worldwide. With the advent of Digital Twin Shop-floor (DTS), digital twins were gained more and more attention on the potential of digital twin in smart manufacturing. The present situation of digital twin in enterprise application and theoretical research was discussed. Based on five-dimensional structure models of digital twin, six application principles were presented. On this basis, fourteen typical application of digital twin and their concepts and key scientific problems or technologies were explored. Which could provide theoretical and methodological reference for engineering practice of digital twin in the future. © 2018, Editorial Department of CIMS. All right reserved.",,Not started,Alex,"October 25, 2022 6:46 PM"
Discussion on the Application of Digital Twins in the Wear of Parts,Academic,Conference Paper,https://www.scopus.com/inward/record.uri?eid=2-s2.0-85088307716&doi=10.1007%2f978-981-15-3753-0_15&partnerID=40&md5=818720a7d49b9aee37d1026d2c728203,"Advance processing, Application method, Application scheme, Automatic production, Computer networks, Digital twin, Heating conditions, Intelligent Manufacturing, Key technologies, Mapping systems, Parts wear, Real time, Safety engineering, Sensitive probe, Wear of materials",China,2021,"The virtual mapping system of physical and information fusion based on digital twin is one of the key technologies to realize intelligent manufacturing. Based on the application method and operation mode of twin in modern workshop, the application scheme of digital twin in parts wear is proposed in this paper. On the basis of the discussion and study of the speed of the machine, the heating condition, and the swaying amplitude, the digital twin technology is used, the model panel is designed, the position of the sensitive probe is set, the collected data is analyzed and inferred, the real-time condition of the machine is judged, and the control panel shows the predicted time point of failure and adjustment. The scheme can be obtained, and the result is helpful to advance the failure and avoid the risk of failure. Therefore, based on digital twin technology, the smooth operation of mechanical automation and unmanned automatic production in factories are guaranteed. © 2021, Springer Nature Singapore Pte Ltd.",,Not started,Alex,"October 25, 2022 6:46 PM"
"Digital Twin-driven smart manufacturing: Connotation, reference model, applications and research issues",Academic,Review,https://www.scopus.com/inward/record.uri?eid=2-s2.0-85070213247&doi=10.1016%2fj.rcim.2019.101837&partnerID=40&md5=9a0d5c501fce6b59922592814303e510,"Application scenario, Big data, Cyber Physical System, Cyber-physical system, Development methodology, Digital twin, Embedded systems, Flow control, Industrial research, Industry 4.0, Reference modeling, Research issues, Smart manufacturing, Standard, Standards, State of the art","New Zealand, United Kingdom",2020,"This paper reviews the recent development of Digital Twin technologies in manufacturing systems and processes, to analyze the connotation, application scenarios, and research issues of Digital Twin-driven smart manufacturing in the context of Industry 4.0. To understand Digital Twin and its future potential in manufacturing, we summarized the definition and state-of-the-art development outcomes of Digital Twin. Existing technologies for developing a Digital Twin for smart manufacturing are reviewed under a Digital Twin reference model to systematize the development methodology for Digital Twin. Representative applications are reviewed with a focus on the alignment with the proposed reference model. Outstanding research issues of developing Digital Twins for smart manufacturing are identified at the end of the paper. © 2019 Elsevier Ltd",,Not started,Alex,"October 25, 2022 6:46 PM"
Digital twin in energy internet and its potential applications,Academic,Conference Paper,https://www.scopus.com/inward/record.uri?eid=2-s2.0-85101642268&doi=10.1109%2fEI250167.2020.9346967&partnerID=40&md5=c47982ad1c9de8065a3bd015b50bfd1f,"Artificial intelligence, Basic concepts, Complex networks, Current energy, Digital twin, Electric power systems, Energy Internet, Energy source, Internet of thing (IOT), Internet of things, Natural gas networks, Supply networks, Technical challenges",China,2020,"The development of information technologies such as the internet of things(IoT), big data, cloud computing, and artificial intelligence has made the global energy rapid advancement in digitalization and intelligence. Based on electric power systems, heat/cold supply networks and natural gas networks, the Energy Internet integrates multiple energy sources to form an interconnected and open energy platform. But the complexity and different characteristics of different energy grids make the planning and operation of Energy Internet placing higher challenges on digitization and intelligence. As a newly technology, Digital Twin aims at promoting the integration of the new generation information technology and manufacturing and better controlling of complex systems, which helps to solve the technical challenges of the current energy internet development. In this paper, the basic concept and development requirements of Energy Internet are firstly discussed, and the concept, technical connotations of Digital Twin are then introduced and summarized, the construction and possible applications of Digital Twin to Energy Internet are discussed. © 2020 IEEE.",,Not started,Alex,"October 25, 2022 6:46 PM"
Multi-aspect applications and development challenges of digital twin-driven management in global smart ports,Academic,Article,https://www.scopus.com/inward/record.uri?eid=2-s2.0-85110468698&doi=10.1016%2fj.cstp.2021.06.014&partnerID=40&md5=b9773a40c0b7a4b87bbcfc9210f697e3,"Digital twin, Digital twin model, Simulation, Smart port, Systematic framework, Visual-based management, cargo handling, environmental protection, integrated approach, management practice, pollutant transport, port",China,2021,"Digital twin (DT) creates a revolutionary opportunity for the smart ports’ authorities, with the capability of high-fidelity digital representation of real-world things. DT-driven management is able to predict potential risk, it is considered to be a key integration involves transport and operation related with smart port supply chains. This paper presents DT information visualizations & outcome loop of global smart ports’ management, and core technique towards smart ports’ processes based on DT-driven management. A systematic framework of DT-based model for smart port's management is presented, which can be categorized into physical layer, data layer, model layer, service layer and application layer. Decision-makers engage in operational management through the DT-based models and platform. To illustrate DT mechanism, multi-aspect functional applications of DT-driven management are discussed, including cargo handling and transportation, containers operation and storage, data communication and sharing, risk prediction, and environmental protection in global smart ports. Meanwhile, this paper proposes concerned challenges of DT-driven management integrated with optimized cross-platform in smart ports’ processes, to indicate there are barriers ahead to get to an ideal visual-based management system. Current challenges help decision-makers to determine where to find a proper strategy to win, in the future, DT visual applications can be extended in several directions of global port industry. This work contributes to address a comprehensive overview of DT managing capabilities together with details of necessary architecture to support effective simulations in virtual port's space. It provides DT-driven platform will enable better management across the smart port activities from design to transport to operation and sustainment of innovative plan. © 2021 World Conference on Transport Research Society",,Not started,Alex,"October 25, 2022 6:46 PM"
"Review of digital twin about concepts, technologies, and industrial applications",Academic,Article,https://www.scopus.com/inward/record.uri?eid=2-s2.0-85087693875&doi=10.1016%2fj.jmsy.2020.06.017&partnerID=40&md5=d2c23bb93aa18432536b333e5fce0311,"Academic publications, Complete search, Digital twin, Enabling technologies, Engineering research, Engineering software, Industrial communities, Industrial product, Industrial research, Life cycle, Literature review, Product lifecycle, Research status, Simulation, Simulation applications, industrial application",China,2021,"Various kinds of engineering software and digitalized equipment are widely applied through the lifecycle of industrial products. As a result, massive data of different types are being produced. However, these data are hysteretic and isolated from each other, leading to low efficiency and low utilization of these valuable data. Simulation based on theoretical and static model has been a conventional and powerful tool for the verification, validation, and optimization of a system in its early planning stage, but no attention is paid to the simulation application during system run-time. With the development of new-generation information and digitalization technologies, more data can be collected, and it is time to find a way for the deep application of all these data. As a result, the concept of digital twin has aroused much concern and is developing rapidly. Dispute and discussions around concepts, paradigms, frameworks, applications, and technologies of digital twin are on the rise both in academic and industrial communities. After a complete search of several databases and careful selection according to the proposed criteria, 240 academic publications about digital twin are identified and classified. This paper conducts a comprehensive and in-depth review of these literatures to analyze digital twin from the perspective of concepts, technologies, and industrial applications. Research status, evolution of the concept, key enabling technologies of three aspects, and fifteen kinds of industrial applications in respective lifecycle phase are demonstrated in detail. Based on this, observations and future work recommendations for digital twin research are presented in the form of different lifecycle phases. © 2020 The Society of Manufacturing Engineers",,Not started,Alex,"October 25, 2022 6:46 PM"
"Concepts, Characteristics and Prospects of Application of Digital Twin in Power System [电力系统数字孪生的概念, 特点及应用展望]",Academic,Review,https://www.scopus.com/inward/record.uri?eid=2-s2.0-85124807412&doi=10.13334%2fj.0258-8013.pcsee.211594&partnerID=40&md5=ce0b3a93b7f7e7c17a9ae4fb29ad316e,"Basic concepts, Digital twin, Electric power systems, Electrical power system, Maturity evaluation, New power system, Performance indices, Power, Power systems simulation, Project quality, System simulation tool, Traditional power system","China, Switzerland",2022,"Aiming at three major problems of digital twin (DT) in electrical power systems, including vague definition, uneven project quality and unclear difference from traditional simulation, DT, together with its related basic concepts were clarified via analyzing various definitions. Based on the main characteristics of DT, five performance indices for maturity evaluation of DT projects were proposed. By reviewing the history of power system simulation tools, reasons why the power system could not breed the concept of DT were discussed, and differences between DT and traditional power system simulation were concluded. On this basis, both direction and enabling fields of DT in power systems were predicted. Following this, several main construction techniques of DT were also introduced. Finally, a case study on the heat pump switching control based on DT of the heating system was conducted, which aimed to show the basic characteristics of DT, and to illustrate the proposed maturity evaluation method. © 2022 Chin. Soc. for Elec. Eng.",,Not started,Alex,"October 25, 2022 6:46 PM"
"The connotation of digital twin, and the construction and application method of shop-floor digital twin",Academic,Article,https://www.scopus.com/inward/record.uri?eid=2-s2.0-85094857400&doi=10.1016%2fj.rcim.2020.102075&partnerID=40&md5=c93dd88b840ca009cda0a5c3abf6f0aa,"Agricultural robots, Application method, Cyber-physical systems, Cyber-physical systems (CPS), Digital twin, Digital twin shop-floor, Dimensional model, Embedded systems, Floors, Implementation techniques, Life cycle, Markov chain, Markov chains, Prediction systems, Product design, Product-life-cycle, Real time monitoring, Shop-floor digital twin, Smart manufacturing",China,2021,"Digital twin (DT) technology provides a novel, feasible, and clear implementation path for the realization of smart manufacturing and cyber-physical systems (CPS). Currently, DT is applied to all stages of the product lifecycle, including design, production, and service, although its application in the production stage is not yet extensive. Shop-floor digital twin (SDT) is a digital mapping model of the corresponding physical shop-floor. How to build and apply SDT has always been challenging when applying DT technology in the production phase. To address the existing problems, this paper first reviews the origin and evolution of DT, including its application status in the production stage. Then, an implementation framework for the construction and application of SDT is proposed. Three key implementation techniques are explained in detail: the five-dimensional modeling of SDT, DT-based 3D visual and real-time monitoring of shop-floor operating status, and prediction of shop-floor operating status based on SDT using Markov chain. A DT-based visual monitoring and prediction system (DT-VMPS) for shop-floor operating status is developed, and the feasibility and effectiveness of the proposed method are demonstrated through the use of an engineering case study. Finally, a summary of the contributions of the paper is given, and future research issues are discussed. © 2020 Elsevier Ltd",,Not started,Alex,"October 25, 2022 6:46 PM"
Opportunities and Challenges of the Digital Twin in Power System Applications [数字孪生在电力系统应用中的机遇和挑战],Academic,Article,https://www.scopus.com/inward/record.uri?eid=2-s2.0-85086633400&doi=10.13335%2fj.1000-3673.pst.2019.1983&partnerID=40&md5=2419c440cec2117b3cdc181d7497b097,"Big data analytics, Closed-loop feedback, Data Analytics, Data-driven, Decision making, Digital twin, Electric power systems, Engineering community, Engineering practices, Grid operation, High-dimensional, Information management, Modeling, Power system applications, Real time interactions, Situation awareness",China,2020,"Digital twin of power systems (PSDT) aims to make full use of the data flow to assist the decision-making on grid operation and management. PSDT faces two major task-1) real-time situation awareness, and 2) ultra-real-time virtual test, and has three properties-1) data-driven, 2) real-time interaction, and 3) closed-loop feedback. Around these, this paper, from both science paradigms and engineering practice, outlines the backgrounds, challenges, framework, tools, and possible directions of DT as a preliminary exploration in the context of power systems. Our work is expected to contribute some novel discoveries, as well as some high-dimensional analytics, to power systems. Besides, the connection of DT with big data analytics and AI may has impact on the engineering community and data science. © 2020, Power System Technology Press. All right reserved.",,Not started,Alex,"October 25, 2022 6:46 PM"
Design and Implementation of Digital Twin-Based Application for Global Manufacturing Enterprises,Academic,Conference Paper,https://www.scopus.com/inward/record.uri?eid=2-s2.0-85115339736&doi=10.1007%2f978-3-030-85914-5_2&partnerID=40&md5=61fb68bdc8ac782fba44084bf8a9cbcf,"CPS-based platform, Cybe-physical system, Cybe-physical system-based platform, Cyber Physical System, Cyber-physical system (CPS), Design and implementations, Digital twin, Embedded systems, Flow control, Global manufacturing, Global manufacturing enterprise, Information Modeling, Information model, Information theory, Key technologies, Manufacture, Manufacturing companies, Manufacturing sites, Smart manufacturing",South Korea,2021,"Nowadays, global competition in the manufacturing sector is increasingly fierce. Thus, global manufacturing companies must have a manufacturing system that ensures the production of reasonably priced, high-quality products, while meeting the needs of various customers. To address this issue, smart manufacturing should be implemented by adopting various information and communication technologies and convergence with existing manufacturing industries. One of the key technologies required for the implementation of smart manufacturing is a cyber-physical system (CPS). One of the major factors for the successful construction of a CPS is digital twin (DT). In this paper, we propose a standards-based information model for building a DT application, which is a key technology of a CPS-based integrated platform, by overcoming the heterogeneous device environment of global manufacturers and using data collected from various manufacturing sites. Furthermore, we propose a concept of modeling and simulation-based DT application. The DT application proposed in this study facilitates monitoring, diagnosis, and prediction at manufacturing sites using real-time data collected from various environments by ensuring interoperability. Moreover, its validity is verified by applying the technology to a global manufacturing company of automotive parts. © 2021, IFIP International Federation for Information Processing.",,Not started,Alex,"October 25, 2022 6:46 PM"
Digital Twins-based Application Development for Digital Manufacturing,Academic,Conference Paper,https://www.scopus.com/inward/record.uri?eid=2-s2.0-85126885033&doi=10.1109%2fCIC52973.2021.00025&partnerID=40&md5=bb01b7fd9f6403a20bd20505f6b6bdb4,"Application development, Building blockes, Costs, Cybe twin, Cyber Twins, Cyberspaces, Digital Manufacturing, Digital twins, Industrial machines, Industrial plants, Industry 4.0, Internet of things, Product consistency, Production efficiency",Australia,2021,"Industry 4.0 applications integrate and analyze information from industrial machines, people involved in production, products, and processes to determine how to improve production efficiency, enhance product consistency, and reduce unplanned maintenance in industrial plants. However, Industry 4.0 application development is currently complex and expensive due to the lack of effective representations of complex industrial machines in the cyberspace, and the limited support of IoT platforms in using such representations to monitor, predict, and mange production outcomes. To simplify the complexity and reduce the cost of Industry 4.0 application development, this paper proposes Cyber Twins (CTs), which is a variant of digital twins that is specifically designed for manufacturing, for representing complex industrial machines and providing the building blocks for Industry 4.0 application development. Furthermore, the paper proposes a platform for CT-based Industry 4.0 application development that overcomes the complexity and cost limitations of existing IoT platforms in developing Industry 4.0 applications. The paper provides examples of CTs for industrial machines and Industry 4.0 applications that demonstrate the benefits of CT-based Industry 4.0 application development via the proposed platform. © 2021 IEEE.",,Not started,Alex,"October 25, 2022 6:46 PM"
Digital Twin Modelling of Ship Power and Propulsion Systems: Application of the Open Simulation Platform (OSP),Academic,Conference Paper,https://www.scopus.com/inward/record.uri?eid=2-s2.0-85089468281&doi=10.1109%2fISIE45063.2020.9152218&partnerID=40&md5=dfdf71e97c90172057a7ec3ac77efb66,"Co-Simulation, Control components, Digital Ship, Digital Twin Modelling, Digital twin, Electric power systems, Environmental challenges, High level controllers, Industrial electronics, Life cycle, Local controllers, Marine power plants, Maritime industry, Modelling and simulation technologies, Open Simulation Platform (OSP), Propulsion system, Ship Power System, Ship electric power systems, Ship propulsion, Ships, Simulation platform",Norway,2020,"Today, modelling and simulation technologies are extensively used in the maritime industry. As a reaction to changing market demands and environmental challenges, maritime systems are becoming more complex and coupled. Digital approaches such as digital twins and co-simulation are coping these challenges and offer new opportunities throughout the lifecycle of a vessel. In this work, we present the digital twin modelling and the co-simulation of a typical AC ship power and propulsion system including the power stage, relevant local controllers and a high-level controller. The power and control components are modelled individually and exported as Functional Mock-up Units (FMUs). To perform a co-simulation of the ship electric power system, the Open Simulation Platform (OSP) is utilized. This co-simulation environment connects the individual FMUs and routes the data between the sub-simulators of the digital twin. A typical test scenario is carried out to demonstrate the correct functioning of the ship power and propulsion system as well as the OSP environment. © 2020 IEEE.",,Not started,Alex,"October 25, 2022 6:46 PM"
Application of a Digital Twin for Proactive Production Planning,Academic,Conference Paper,https://www.scopus.com/inward/record.uri?eid=2-s2.0-85139744032&doi=10.5957%2fSMC-2022-058&partnerID=40&md5=b70cbd835715a165c7ea0fcc7fc25790,"Design-science researches, Industrial research, Planning, Production Planning, Production control, Real-time production, Requirement analysis, Scheduling, computer applications, design science research, disruption management, shipbuilding",Germany,2022,"This paper presents the underlying method of a proposed digital twin for proactive production planning. We derived the method based on a requirements analysis considering the challenges in maritime production. Using real-time production feedback data, alternative production scenarios are identified to prevent disruptions and delays in manufacturing and assembly. As part of the ProProS research project, the method is implemented and validated through the development of the digital twin, which offers a platform for the realization of further use cases to be diffused into industrial applications. Copyright © 2022 Society of Naval Architects and Marine Engineers (SNAME)",,Not started,Alex,"October 25, 2022 6:46 PM"
Data Construction Method for the Applications of Workshop Digital Twin System,Academic,Conference Paper,https://www.scopus.com/inward/record.uri?eid=2-s2.0-85080033682&doi=10.1016%2fj.jmsy.2020.02.003&partnerID=40&md5=8c9d634cfe61e57929959f8c02e43322,"Application-oriented, Cutting tools, Data construction, Data organization, Data representations, Data support, Digital twin, Functional requirement, Information management, Large amounts, Manufacture, Workshop",China,2021,"Data is the key to the operation of manufacturing workshop Digital Twin System (DTS) and also supports the top-level applications of DTS. However, manufacturing data has the characteristics of coupling and large-amount, which lead to inefficient and inaccurate operations of applications. In order to provide stable and efficient data support for the applications of DTS, this paper proposed a data construction method. The framework of data construction is designed based on the functional requirements, which are analyzed according to the characteristics of manufacturing data. Then, module implementation of the framework, including data representation module, data organization module and data management module, is introduced in detail. Finally, application of cutting tool wear prediction is taken as a case study to show the feasibility and effectiveness of the proposed data construction method. © 2020 The Society of Manufacturing Engineers",,Not started,Alex,"October 25, 2022 6:46 PM"
