Name,Type,Material Type,Link,Keyword,Country,Year,Abstract,Responsible,Status,Created by,Created time
Digital twin design for real-time monitoring - a case study of die cutting machine,Academic,Technical paper,https://www.tandfonline.com/doi/full/10.1080/00207543.2020.1817999,"Digital twin, monitoring",Taiwan,,,,Not started,Alex,"October 18, 2022 2:38 PM"
https://ieeexplore.ieee.org/document/9325551/,Academic,Technical paper,https://ieeexplore.ieee.org/stamp/stamp.jsp?tp=&arnumber=9325551,"Digital twin, Healthcare, monitoring",Italy,,,,Not started,Alex,"October 18, 2022 2:47 PM"
"Digital Twin: Values, Challenges and Enablers From a Modeling Perspective",Academic,Technical paper,https://ieeexplore.ieee.org/stamp/stamp.jsp?tp=&arnumber=8972429,"Digital twin, Hybrid Analysis and Modeling, Machine learning","Norway, United States",,,,Not started,Alex,"October 18, 2022 2:58 PM"
Cyber-Physical Cloud Manufacturing Systems With Digital,Academic,Technical paper,https://ieeexplore.ieee.org/stamp/stamp.jsp?tp=&arnumber=9353208,"Digital twin, MTconnect, cyberphysical cloud manufacturing (CPCM) systems",United States,,,,Not started,Alex,"October 18, 2022 3:04 PM"
Data‐driven physics‐based digital twins via a library of component‐based reduced‐order models,Academic,Technical paper,https://onlinelibrary.wiley.com/doi/epdf/10.1002/nme.6423,"Digital twin, data-model fusion, reduced-order model","Switzerland, United States",,,,Not started,Alex,"October 18, 2022 3:11 PM"
"Autonomous, context-aware, adaptive Digital Twins—State of the art and roadmap",Academic,Technical paper,https://www.sciencedirect.com/science/article/pii/S0166361521001159/pdfft?md5=9182c4ea09cdc8d60c74a5e2098f039e&pid=1-s2.0-S0166361521001159-main.pdf,"Autonomy, Digital factories, Digital twin, State of the art","Germany, Greece, Italy",,,,Not started,Alex,"October 18, 2022 3:18 PM"
Digital Twins,Academic,Cumulative report,https://ieeexplore.ieee.org/stamp/stamp.jsp?tp=&arnumber=9713922,"Digital twin, State of the art",Not Applicable,,,,Not started,Alex,"October 18, 2022 3:26 PM"
Digital Twins Technology,Academic,Book,https://doi.org/10.1201/9781003132868,"Applications, Techniques & concepts","Egypt, India",,,,Not started,Alex,"October 18, 2022 3:32 PM"
"The connotation of digital twin, and the construction and application method of shop-floor digital twin",Academic,Technical paper,https://www.sciencedirect.com/science/article/pii/S0736584520302854/pdfft?md5=f51962adc4d722b1c180dc90585dae96&pid=1-s2.0-S0736584520302854-main.pdf,"Digital Mapping, Digital twin, Feasibility, Markov chains, Product life cycle, Shop floor",China,,,,Not started,Alex,"October 18, 2022 3:42 PM"
Digital Twin as a Service (DTaaS) in Industry 4.0: An Architecture Reference Model,Academic,Technical paper,https://www.sciencedirect.com/science/article/pii/S1474034620301944/pdfft?md5=471a141581b971291af50d2f517d9004&pid=1-s2.0-S1474034620301944-main.pdf,"Architecture, Digital twin","Hong Kong, New Zealand",,,,Not started,Alex,"October 18, 2022 3:53 PM"
NTT - Nippon Telegraph and Telephone,Industrial,Website,https://services.global.ntt/en-us/about-us/tour-de-france-report?utm_source=PPC&utm_medium=Paid&utm_campaign=NTTGL_TDF&utm_content=Report_IND&campaignID=7018d000000ksqpAAA&gclid=CjwKCAjwwL6aBhBlEiwADycBIIr3vbUWrnlU5vZ3rQwYdFl8kNsTsTIDep7oYqrenKN58gZ1oaq6YhoCQfoQAvD_BwE,"Healthcare, IT solutions, Manufacturing, Racing",Japan,,,,Not started,Alex,"October 19, 2022 2:42 PM"
Pratiti Technologies,Industrial,Website,https://www.pratititech.com/technology-expertise/digital-twin-software-platforms/,"Automobile, Digital twin, Healthcare, IT solutions, Manufacturing, PaaS",India,,,,Not started,Alex,"October 19, 2022 3:05 PM"
Intangles,Industrial,Website,https://www.intangles.ai/,"Automobile, Digital twin, PaaS, Prediction & Forecast, monitoring",India,,,,Not started,Alex,"October 19, 2022 3:34 PM"
DT Global Survey Report 2022 (By Altair),Business,Report,https://www.altair.com/docs/default-source/pdfs/altair_dt-global-survey-report_web.pdf?sfvrsn=b5aceaa9_28&_ga=2.128919884.1946484581.1666187325-345248934.1666187325&_gac=1.260187903.1666187325.CjwKCAjwwL6aBhBlEiwADycBIJL7R463YqVXXwMWJaNcbb-87j6dckBr8mB81LW-GjfzVvZC_YiOmRoCeCoQAvD_BwE,"Applications, Digital twin, Techniques & concepts",United States,,,,Not started,Alex,"October 19, 2022 3:50 PM"
Altair,Industrial,Website,https://altair.com/one-total-twin/?utm_source=google-ads&utm_medium=cpc&utm_campaign=IMC-Digital-Twin-Brand&gclid=CjwKCAjwwL6aBhBlEiwADycBIJL7R463YqVXXwMWJaNcbb-87j6dckBr8mB81LW-GjfzVvZC_YiOmRoCeCoQAvD_BwE,"Digital twin, IT solutions, PaaS, Product life cycle",United States,,,,Not started,Alex,"October 19, 2022 3:55 PM"
MetaTwin,Industrial,Website,https://www.metatwin.net/digitaler-zwilling,"Digital twin, Manufacturing, Prediction & Forecast",Germany,,,,Not started,Alex,"October 19, 2022 4:17 PM"
Digital twin companies (By Dashdevs),Business,Cumulative report,https://dashdevs.com/blog/product-owner-talks-20-digital-twins-service-companies/,Digital twin,United States,,,,Not started,Alex,"October 19, 2022 4:37 PM"
General Electric,Industrial,Website,https://www.ge.com/digital/applications/digital-twin,"Digital twin, Machine learning, monitoring",United States,,,,Not started,Alex,"October 19, 2022 5:02 PM"
Digital twin report (By Siemens),Business,Report,https://blogs.sw.siemens.com/xcelerator/2022/05/09/digital-twin-study/,Digital twin,Germany,,,,Not started,Alex,"October 19, 2022 5:40 PM"
Siemens,Industrial,Website,https://new.siemens.com/global/en/company/stories/industry/the-digital-twin.html,"Digital twin, Product life cycle",Germany,,,,Not started,Alex,"October 19, 2022 5:40 PM"
IBM,Industrial,Website,https://www.ibm.com/topics/what-is-a-digital-twin,Digital twin,United States,,,,Not started,Alex,"October 19, 2022 5:57 PM"
Oracle,Industrial,Website,https://docs.oracle.com/en/cloud/paas/iot-cloud/iotgs/oracle-iot-digital-twin-implementation.html,"Digital twin, Prediction & Forecast, monitoring",United States,,,,Not started,Alex,"October 19, 2022 6:14 PM"
Foresight Sustainability Suite (By QiO),Industrial,Website,https://qio.io/,"Digital twin, Prediction & Forecast, Sustainability, monitoring",UK,,,,Not started,Alex,"October 19, 2022 6:17 PM"
Sight Machine,Industrial,Website,https://sightmachine.com/what-is-digital-twin/,"Digital twin, Machine learning, Manufacturing",United States,,,,Not started,Alex,"October 19, 2022 6:26 PM"
Eclipse ditto (By BOSCH),Industrial,Website,https://www.eclipse.org/ditto/,"Digital twin, PaaS",Germany,,,,Not started,Alex,"October 19, 2022 6:31 PM"
DigitBrain,Industrial,Website,https://digitbrain.eu/,"Digital twin, Manufacturing",EU,,,,Not started,Alex,"October 19, 2022 6:36 PM"
List of virtual twin developing software,Business,Website,https://www.g2.com/categories/digital-twin,"Digital twin, Prediction & Forecast, monitoring",Global,,,,Not started,Alex,"October 19, 2022 6:46 PM"
Braincube,Industrial,Website,https://braincube.com/solutions/digital-twin/,"Digital twin, Manufacturing",France,,,,Not started,Alex,"October 19, 2022 7:00 PM"
IoTwins,Industrial,Website,https://www.iotwins.eu/,Digital twin,EU,,,,Not started,Alex,"October 19, 2022 7:04 PM"
Digital Twin Market,Business,Website,https://tinyurl.com/mpxw42jx,"Applications, Automobile, Digital twin, Manufacturing",Global,,,,Not started,Alex,"October 19, 2022 7:09 PM"
Untangling the requirements of Digital twin,Academic,Report,https://www.amrc.co.uk/files/document/406/1605271035_1604658922_AMRC_Digital_Twin_AW.pdf,Digital twin,UK,,,,Not started,Alex,"October 19, 2022 7:15 PM"
Industry 4.0 and the digital twin,Business,Report,https://www2.deloitte.com/content/dam/Deloitte/kr/Documents/insights/deloitte-newsletter/2017/26_201706/kr_insights_deloitte-newsletter-26_report_02_en.pdf,Digital twin,Italy,,,,Not started,Alex,"October 19, 2022 7:22 PM"
Digital Twin Market Size (By Grand view Research),Business,Website,https://www.grandviewresearch.com/industry-analysis/digital-twin-market,Digital twin,Global,,,,Not started,Alex,"October 19, 2022 7:26 PM"
Digital Twin Market Size (By fortune business insights),Business,Website,https://www.fortunebusinessinsights.com/digital-twin-market-106246,Digital twin,Global,,,,Not started,Alex,"October 19, 2022 7:31 PM"
WareBee,Industrial,,,,,,,,Not started,Pedro Luis Bacelar dos Santos,"October 20, 2022 3:16 PM"
WareBee,Industrial,Website,https://warebee.com,"Digital twin, Warehouse",UK,,,,Not started,Pedro Luis Bacelar dos Santos,"October 20, 2022 3:18 PM"
Twinu,Industrial,Website,https://www.twinu.com,"Digital twin, NFT",Germany,,,,Not started,Pedro Luis Bacelar dos Santos,"October 20, 2022 3:20 PM"
Application of digital twins in condition-based maintenance,Academic,Technical paper,https://rpsonline.com.sg/proceedings/9789811820168/pdf/365.pdf,"Applications, Diagnosis, Digital twin, Maintenance","China, Norway",,,,Not started,Alex,"October 20, 2022 3:35 PM"
ReLOG3P,Industrial,Website,https://relog3p.com,"Digital twin, Logistics, Machine learning",Italy,,,,Not started,Pedro Luis Bacelar dos Santos,"October 20, 2022 3:39 PM"
SEKAI Digital Twins Ltd,Industrial,Website,https://www.sekai.io/#continuious,"Digital factories, Digital twin, Manufacturing, monitoring",Malta,,,,Not started,Pedro Luis Bacelar dos Santos,"October 20, 2022 3:40 PM"
TonePedia,Industrial,Website,https://www.tonepedia.com,"Digital twin, ecomerce",Germany,,,,Not started,Pedro Luis Bacelar dos Santos,"October 20, 2022 3:40 PM"
Digital Twin Application in Healthcare Facilities Management,Academic,Technical paper,https://ascelibrary.org/doi/10.1061/9780784483893.046,"Applications, Digital twin, Healthcare, Maintenance",United States,,,,Not started,Alex,"October 20, 2022 3:47 PM"
Orbit GT,Industrial,Website,https://orbitgt.com,"Digital twin, Smart Cities",Belgium,,,,Not started,Pedro Luis Bacelar dos Santos,"October 20, 2022 3:48 PM"
AppsBow,Industrial,Website,https://www.eu-startups.com/directory/appsbow/,"Digital twin, virtual reality",Poland,,,,Not started,Pedro Luis Bacelar dos Santos,"October 20, 2022 3:57 PM"
Digital-Twin for Production Monitoring and Optimisation: Two Case Study Application Examples,Academic,Technical paper,https://www.scopus.com/record/display.uri?eid=2-s2.0-85127637728&origin=resultslist&sort=plf-t&src=s&st1=digital+twin&st2=application&nlo=&nlr=&nls=&sid=b53ce3a56a56cd41b071f8a8d751ebc5&sot=b&sdt=b&sl=63&s=%28TITLE%28digital+twin%29+AND+TITLE%28application%29%29+AND+PUBYEAR+%3e+2020&relpos=6&citeCnt=0&searchTerm=,"Applications, Digital twin, Optimization, Prediction & Forecast, Production",United States,,,,Not started,Alex,"October 20, 2022 3:58 PM"
Infinite Foundry,Industrial,Website,https://www.infinitefoundry.com,"3D Simulations, Digital twin",Portugal,,,,Not started,Pedro Luis Bacelar dos Santos,"October 20, 2022 4:41 PM"
TWAICE,Industrial,Website,https://www.twaice.com,"Baterry, Digital twin",Germany,,,,Not started,Pedro Luis Bacelar dos Santos,"October 20, 2022 4:41 PM"
Digital Twins-based Application Development for Digital Manufacturing,Academic,Technical paper,https://ieeexplore.ieee.org/stamp/stamp.jsp?tp=&arnumber=9707159,"Applications, Digital twin, Manufacturing, Production","Australia, Belgium",,,,Not started,Alex,"October 20, 2022 4:44 PM"
Digital Twin Studios,Industrial,Website,https://dtsxr.com,"3D Simulations, Digital twin",United States,,,,Not started,Pedro Luis Bacelar dos Santos,"October 20, 2022 4:44 PM"
Maplewell,Industrial,Website,https://www.maplewelleng.com,"Digital twin, Energy",United States,,,,Not started,Pedro Luis Bacelar dos Santos,"October 20, 2022 4:46 PM"
Artemis Technologies,Industrial,Website,https://www.artemistechnologies.co.uk,"Digital twin, Manufacturing",Ireland,,,,Not started,Pedro Luis Bacelar dos Santos,"October 20, 2022 4:47 PM"
https://www.ventureradar.com/organisation/Kavida%20Technologies/c0842a5a-706f-4fa2-9bb9-8143200d32f0,Industrial,Website,https://www.kavida.ai,"Digital twin, Supply Chain",United States,,,,Not started,Pedro Luis Bacelar dos Santos,"October 20, 2022 4:49 PM"
A review of SQL vs NOSQL database for nuclear reactor digital twin applications: with example Mongodb based NOSQL database for digital twin model of a pressurized-water-reactor steam-generator,Academic,Technical paper,https://asmedigitalcollection.asme.org/IMECE/proceedings-abstract/IMECE2021/85697/V013T14A003/1133262,"Database, Digital twin, Optimization, monitoring",United States,,,,Not started,Alex,"October 20, 2022 4:53 PM"
https://www.ventureradar.com/organisation/Infera/9bd1d92c-193f-4295-8ce4-3056cee5596a,Industrial,Website,https://infera.ai,"Digital twin, Prediction & Forecast",Canada,,,,Not started,Pedro Luis Bacelar dos Santos,"October 20, 2022 4:53 PM"
Application of Digital Twin to Monitor and Optimize Utility Process,Academic,Technical paper,https://ieeexplore.ieee.org/stamp/stamp.jsp?tp=&arnumber=9649804,"Applications, Digital twin, Optimization, monitoring","South Korea, UK",,,,Not started,Alex,"October 20, 2022 4:56 PM"
https://www.ventureradar.com/organisation/CONTILIO%20LIMITED/f4d4bc11-5feb-4465-aa95-682f50bc9533,Industrial,Website,https://www.contilio.com,"Building, Digital twin",UK,,,,Not started,Pedro Luis Bacelar dos Santos,"October 20, 2022 4:56 PM"
A Review: Machine Tools Digital Twin Modeling and Application,Academic,Technical paper,https://ieeexplore.ieee.org/stamp/stamp.jsp?tp=&arnumber=9594151,"Applications, Digital twin, Manufacturing",China,,,,Not started,Alex,"October 20, 2022 5:01 PM"
Building Discrete-Event Simulation for Digital Twin Applications in Production Systems,Academic,Technical paper,https://ieeexplore.ieee.org/stamp/stamp.jsp?tp=&arnumber=9613425,"Applications, Digital twin, Discrete event simulation, Production",Canada,,,,Not started,Alex,"October 20, 2022 5:03 PM"
Automated Model Transformation in modeling  Twins of Industrial Internet-of-Things Applications utilizing AutomationML,Academic,Technical paper,https://ieeexplore.ieee.org/stamp/stamp.jsp?tp=&arnumber=9613172,"Applications, Architecture, Digital twin, Manufacturing, Modeling",Germany,,,,Not started,Alex,"October 20, 2022 5:06 PM"
Life Cycle of a Digital Resource Twin: Meta-Modeling and Application Example,Academic,Technical paper,https://www.sciencedirect.com/science/article/pii/S2212827121011756?pes=vor,"Digital twin, Modeling, Product life cycle",Germany,,,,Not started,Alex,"October 20, 2022 5:28 PM"
"Digital Twin Market by Enterprise, Application",Business,Website,https://www.marketsandmarkets.com/Market-Reports/digital-twin-market-225269522.html,"Applications, Digital twin",Global,,,,Not started,Pedro Luis Bacelar dos Santos,"October 20, 2022 5:35 PM"
"Real-time combination of material flow simulation, digital twins of manufacturing cells, an AGV and a mixed-reality application",Academic,Technical paper,https://www.sciencedirect.com/science/article/pii/S2212827121011690?pes=vor,"Applications, Digital twin, Discrete event simulation, Manufacturing",Germany,,,,Not started,Alex,"October 20, 2022 5:38 PM"
GE Analysis,Business,Website,https://www.ge.com/digital/blog/what-digital-twin,,,,,,Not started,Pedro Luis Bacelar dos Santos,"October 20, 2022 5:40 PM"
Pattern-based digital twin for optimizing manufacturing systems: A real industrial-case application,Academic,Technical paper,https://www.sciencedirect.com/science/article/pii/S2405896321009265?pes=vor,"Applications, Digital twin, Maintenance, Prediction & Forecast","France, Italy",,,,Not started,Alex,"October 20, 2022 5:42 PM"
,,,,,,,,,Not started,Alex,"October 20, 2022 5:44 PM"
IBM DT,Industrial,Website,https://www.ibm.com/topics/what-is-a-digital-twin,"Digital twin, Explanation",Global,,,,Not started,Pedro Luis Bacelar dos Santos,"October 20, 2022 5:51 PM"
PTC Digital Twin,Industrial,Website,https://www.ptc.com/-/media/Files/PDFs/Manufacturing/State-of-Digital-Twin-2022.pdf,"Digital twin, Explanation",Global,,,,Not started,Pedro Luis Bacelar dos Santos,"October 20, 2022 5:51 PM"
Azure Digital Twin,Industrial,Website,https://azure.microsoft.com/en-gb/products/digital-twins/#overview,"Digital twin, IoT, Platform",Global,,,,Not started,Pedro Luis Bacelar dos Santos,"October 20, 2022 5:59 PM"
Ansys Digital Twin,Industrial,Website,https://www.ansys.com/products/digital-twin,"3D Simulations, Digital twin",Global,,,,Not started,Pedro Luis Bacelar dos Santos,"October 20, 2022 6:00 PM"
SWIM EDX,Industrial,Website,https://blog.swim.ai/introducing-digital-twins-that-learn-swim-edx,"Digital twin, Platform, Prediction & Forecast",Global,,,,Not started,Pedro Luis Bacelar dos Santos,"October 20, 2022 6:02 PM"
Pedro 14:19 25/10,Academic,Technical paper,,,,,,,Not started,Pedro Luis Bacelar dos Santos,"October 25, 2022 2:19 PM"
,,,,,,,,,Not started,Pedro Luis Bacelar dos Santos,"October 25, 2022 2:21 PM"
Real-Time Data-Driven Digital Twin Workshop Web Interactive Application,Academic,Conference Paper,https://www.scopus.com/inward/record.uri?eid=2-s2.0-85127043897&doi=10.1007%2f978-981-19-0572-8_13&partnerID=40&md5=63438300bf86ac5a4f9d4010095d6814,"Accident prevention, Data display, Data driven, Data interactions, Development technology, Digital twin, Process control, Process monitoring, Production line, Production process, Real-time alarm, Real-time data, Web development, Web interactive",China,2022,"With the increasing development of industrial intelligence, the application of digital twin workshops has become popular, but there are still humanization issues such as convenience, safety, and visualization. Therefore, based on the digital twin system of the actual workshop production line, using Web development technology to realize real-time alarm, process monitoring, data display and interaction with the digital twin system in response to problems that be encountered in the actual production process, such as failures, monitoring, and data analysis in this article. The real-time production situation of the workshop is functionally presented on the digital twin page, which can observe the on-site production line more clearly, effectively improving the overall intuition, failure and safety. At the same time, the realization of the interactive function with the digital twin system also enhances the closeness of the connection with reality. © 2022, The Author(s), under exclusive license to Springer Nature Singapore Pte Ltd.",,Not started,Alex,"October 25, 2022 6:46 PM"
Digital Twin Testbed and Practical Applications in Production Logistics with Real-Time Location Data,Academic,Article,https://www.scopus.com/inward/record.uri?eid=2-s2.0-85108521095&doi=10.24867%2fIJIEM-2021-2-282&partnerID=40&md5=7a101271f83923a31e1567cf29934922,"Automated guided vehicle, Digital twin, Production logistics, Real-time location, Simulation","Germany, Sweden",2021,"Nowadays, digital twins exist everywhere in various fields. However, an analysis of existing applications in manufacturing and logistics revealed that many entirely apply the concept. To identify when a complete implementation of the concept is beneficial, we analyse the need and the implications within production logistics. This study also presents an architecture supporting integrating a digital twin into production logistics and a corresponding application scenario. Based on this, we have derived practical applications. Each application is applied to different situations, and actual benefits can overcome the limitations of the previous studies. © 2021. All Rights Reserved.",,Not started,Alex,"October 25, 2022 6:46 PM"
Composition and application of power system digital twins based on ontological modeling,Academic,Conference Paper,https://www.scopus.com/inward/record.uri?eid=2-s2.0-85079066546&doi=10.1109%2fINDIN41052.2019.8972267&partnerID=40&md5=094faae062bfab9239f40b8b7fd8064b,"Digital storage, Digital twin, Distributed energy resources, Electric energy storage, Electric power systems, Electronic documentation, Generative design, Hybrid power supply systems, Industrial informatics, Internet of Energy, Low voltage distribution network, Modeling, Modeling languages, Models, Network architecture, Ontology, Renewable energy resources, Renewable energy source, Small-scale generations, Software prototyping, Voltage distribution measurement",Russian Federation,2019,"The approach to create power system digital twins is presented by the example of energy supply of a geographically localized RD facility. In this paper, the six-layer digital twin architecture is proposed and its prototype software implementation is described. The architecture consists of an ontological model, a digital single line diagram, electronic documentation, master data, load measurement data, and mathematical models and simulations. The paper describes problems and principles of ontological modeling of the prosumer infrastructure, including customer load, low-voltage distribution network sections, small-scale generation equipment, and electric energy storage devices. The optimal configuration of the hybrid power supply system with renewable energy sources was computed using the digital twin that was composed according to the presented approach. For machine-readable representation of the digital twin, the ontological modeling language OWL is used. © 2019 IEEE.",,Not started,Alex,"October 25, 2022 6:46 PM"
Value-Driven Robotic Digital Twins in Cyber-Physical Applications,Academic,Article,https://www.scopus.com/inward/record.uri?eid=2-s2.0-85101785830&doi=10.1109%2fTII.2020.3011062&partnerID=40&md5=5d203172237ad7a555af6c97fbe9fa7c,"Competitive edges, Cost effectiveness, Cyber Physical System, Cyber physicals, Cyber-physical systems, Digital twin, Functional capabilities, Industrial manipulators, Intelligent robots, Key technologies, Manipulators, Physical robots, Robot applications, Robot manipulator, Robot performance, Virtual test beds, digital twins (DTs), robotics",Germany,2021,"Although the skills of robot manipulators are becoming technically more complex, the unprecedented cost-effective access to recently unveiled intelligent robots has the potential to unleash as yet unimagined automation capabilities. A key technology behind this opportunity for companies to gain a competitive edge through an informed and intelligent robotized automation is the robotic digital twin (RDT). As such, the RDT will be instrumental in mirroring targeted properties of a physical robot to obtain a digital sibling flexibly harnessed in virtual testbeds to understand, predict, and shape the robot performance. However, these objectives remain challenging to well-established simulators. This is because the architectural and functional capabilities they support are not sufficiently in-line with ever-growing and varying demands for agile and cost-efficient manipulations. As a consequence, robot stakeholders can hardly use RDTs to unlock opportunities and meet needs from prospective markets. This article contributes to addressing this gap. We introduce a novel concept for the development of a RDT that helps create and add value to current and future robotized cyber-physical applications. Hereinafter, referred to as the value-driven RDT (vdRDT), it systematically captures the robot dynamics and purposefully farms data, about which its services reason, to facilitate insight and deliver capabilities as well as benefits to stakeholders. Experiment results show that vdRDTs enlarge the scope of, adapt to, and revitalize robotized applications carried out in different fields. © 2005-2012 IEEE.",,Not started,Alex,"October 25, 2022 6:46 PM"
Digital twin applications in aviation industry: A review,Academic,Review,https://www.scopus.com/inward/record.uri?eid=2-s2.0-85135421849&doi=10.1007%2fs00170-022-09717-9&partnerID=40&md5=f4c1069d9862bc6be075a982716a41b7,"Aviation industry, Data fusion, Digital transformation, Digital twin, Embedded systems, Government authorities, Industrial research, Life cycle, Life cycle management, Lifecycle management, Low maintenance, Maintenance efficiency, Operations cost, Production operations, Reliable systems, Research laboratories, Secure system",China,2022,"As a highly secure and reliable system, aviation faces challenges including digital transformation, high production operation costs, low maintenance efficiency, and intensive technology. One of the most beneficial technologies is the digital twin (DT), which can solve the above issues. This paper investigates aviation industry DT from government authorities, industry, and academia. Firstly, it surveys the development of the definition of DT and compares its concepts with the Internet of Things, cyber-physical systems, and digital thread etc. Next, it shows the research timeline of aviation DT in the past 10 years by authorities such as Air Force Research Laboratory and National Aeronautics and Space Administration. Then, this paper reviews the state-of-the-art research status of DT in the whole lifecycle of the aviation system and concludes that aviation DT is the most widely used in manufacturing and maintenance, and should pay attention to the application of UAV DT. Finally, it summarizes that data fusion, high-fidelity modeling, integration with New IT, and human–machine interaction are the key technologies of aviation DT. The future possible research directions could be digital process twin risk control, interactive DT, and DT data learning. © 2022, The Author(s), under exclusive licence to Springer-Verlag London Ltd., part of Springer Nature.",,Not started,Alex,"October 25, 2022 6:46 PM"
