Name,Type,Material Type,Link,Keyword,Country,Year,Abstract,Responsible,Status,Created by,Created time
DT-II:Digital twin enhanced Industrial Internet reference framework towards smart manufacturing,Academic,Article,https://www.scopus.com/inward/record.uri?eid=2-s2.0-85073509951&doi=10.1016%2fj.rcim.2019.101881&partnerID=40&md5=b3afbfcef57bc710316b101e047bc83c,"Data acquisition, Data acquisition and transmissions, Design and Development, Digital twin, Flow control, Industrial Internet platform, Industrial internet, Life cycle, Life-cycle management, Manufacture, Product lifecycle, Product-life-cycle, Production/manufacturing, Smart manufacturing, Steam turbines","China, Taiwan",2020,"In this paper, the interplay and relationship between digital twin and Industrial Internet are discussed at first. The sensing/transmission network capability, which is one of the main characteristics of Industrial Internet, can be a carrier for providing digital twin with a means of data acquisition and transmission. Conversely, with the capability of high-fidelity virtual modeling and simulation computing/analysis, digital twin evolving from lifecycle management for a single product to application in production/manufacturing in the shop-floor/enterprise, can further greatly enhance the simulation computing and analysis of Industrial Internet. This paper proposes a digital twin enhanced Industrial Internet (DT-II) reference framework towards smart manufacturing. To further illustrate the reference framework, the implementation and operation mechanism of DT-II is discussed from three perspectives, including product lifecycle level, intra-enterprise level and inter-enterprise level. Finally, steam turbine is taken as an example to illustrate the application scenes from above three perspectives under the circumstance of DT-II. The differences between with and without DT-II for design and development of steam turbine are also presented. © 2019 Elsevier Ltd",,Not started,Alex,"October 25, 2022 7:00 PM"
Sustainable development of smart manufacturing driven by the digital twin framework: A statistical analysis,Academic,Article,https://www.scopus.com/inward/record.uri?eid=2-s2.0-85114912108&doi=10.3390%2fsu131810139&partnerID=40&md5=98489ff597d744210b96cd4f35ad0372,"Artificial intelligence, Deep Learning, Digital twin, Industry 4.0, Machine learning, Manufacturing, Proknow-C, Scopus, Sustainable development, Varanidae, algorithm, detection method, statistical analysis",India,2021,"The Fourth Industrial Revolution drives industries from traditional manufacturing to the smart manufacturing approach. In this transformation, existing equipment, processes, or devices are retrofitted with some sensors and other cyber-physical systems (CPS), and adapted towards digital production, which is a blend of critical enabling technologies. In the current scenario of Industry 4.0, industries are shaping themselves towards the development of customized and cost-effective processes to satisfy customer needs with the aid of a digital twin framework, which enables the user to monitor, simulate, control, optimize, and identify defects and trends within, ongoing process, and reduces the chances of human prone errors. This paper intends to make an appraisal of the literature on the digital twin (DT) framework in the domain of smart manufacturing with the aid of critical enabling technologies such as data-driven systems, machine learning and artificial intelligence, and deep learning. This paper also focuses on the concept, evolution, and background of digital twin and the benefits and challenges involved in its implementation. The Scopus and Web of Science databases from 2016 to 2021 were considered for the bibliometric analysis and used to study and analyze the articles that fall within the research theme. For the systematic bibliometric analysis, a novel approach known as Proknow-C was employed, including a series of procedures for article selection and filtration from the existing databases to get the most appropriate articles aligned with the research theme. Additionally, the authors performed statistical and network analyses on the articles within the research theme to identify the most prominent research areas, journal/conference, and authors in the field of a digital twin. This study identifies the current scenarios, possible research gaps, challenges in implementing DT, case studies and future research goals within the research theme. © 2021 by the authors. Licensee MDPI, Basel, Switzerland.",,Not started,Alex,"October 25, 2022 7:00 PM"
Architecture and use cases of digital twins towards smart manufacturing,Academic,Article,https://www.scopus.com/inward/record.uri?eid=2-s2.0-85118846016&doi=10.1504%2fIJPSPM.2021.118698&partnerID=40&md5=7ad6f6315f83fb5561e61e860999c716,"Cyber physical systems (IoT), Digital twin, Internet of things, IoT",United Arab Emirates,2021,"Most existing companies have embraced digital twin. IBM, Cisco and GE are more focused on creating CPS related systems and technologies. These companies have next generation core infrastructure. The first step was smart manufacturing of IoT and artificial intelligence to move towards recognising the pre-required detectors in the components of the machine from which the data will be obtained by real-time analytics. The fusion of human, information and smart/intelligent algorithms has far-accomplishing outcomes on manufacturing performance. However, the in-depth communication and excessive amounts of facts involved also brings in new demanding situations. The architecture of digital twins and a few cases of cyber physical structure have been discussed in this chapter. The area of smart output artificial intelligence along with the field of machine learning has also been discussed. In this way, the intermingling of IoT and machine learning with digital twins will improve profitability, consistency and nature of the products. Copyright © 2021 Inderscience Enterprises Ltd.",,Not started,Alex,"October 25, 2022 7:00 PM"
Digital twin-driven rapid reconfiguration of the automated manufacturing system via an open architecture model,Academic,Article,https://www.scopus.com/inward/record.uri?eid=2-s2.0-85076833589&doi=10.1016%2fj.rcim.2019.101895&partnerID=40&md5=460eb2547c7fb1d1e30d7b2771174756,"Architecture, Automated manufacturing systems, Computer aided manufacturing, Cyber Physical System, Cyber-physical system, Digital twin, Embedded systems, Enabling techniques, Fixed platforms, Machine tools, Manufacture, Open architecture, Reconfigurable architectures, Reconfigurable manufacturing system, Reconfiguration process, Semi-physical simulations, Smart manufacturing, industrial internet of things",China,2020,"Increasing individualization demands in products call for high flexibility in the manufacturing systems to adapt changes. This paper proposes a novel digital twin-driven approach for rapid reconfiguration of automated manufacturing systems. The digital twin comprises two parts, the semi-physical simulation that maps data of the system and provides input data to the second part, which is optimization. The results of the optimization part are fed back to the semi-physical simulation for verification. Open-architecture machine tool (OAMT) is defined and developed as a new class of machine tools comprising a fixed standard platform and various individualized modules that can be added and rapidly swapped. Engineers can flexibly reconfigure the manufacturing system for catering to process planning by integrating personalized modules into its OAMTs. Key enabling techniques, including how to twin cyber and physical system and how to quickly bi-level program the production capacity and functionality of manufacturing systems to adapt rapid changes of products, are detailed. A physical implementation is conducted to verify the effectiveness of the proposed approach to achieving improved system performance while minimizing the overheads of the reconfiguration process by automating and rapidly optimizing it. © 2019 Elsevier Ltd",,Not started,Alex,"October 25, 2022 7:00 PM"
A quality-oriented digital twin modelling method for manufacturing processes based on a multi-agent architecture,Academic,Conference Paper,https://www.scopus.com/inward/record.uri?eid=2-s2.0-85099833723&doi=10.1016%2fj.promfg.2020.10.044&partnerID=40&md5=7293a25e4e30dfd910dbef31b080c0f6,"Digital twin, Manufacturing processes, Multi-Agent System, Quality control","Italy, Switzerland",2020,"The quality of a product is highly dependent on manufacturing processes. The recent development of industrial information technologies, such as Cyber-Physical Production Systems, Industrial Internet of Things, and Big Manufacturing Data Analytics has empowered the digitalization of manufacturing processes and promoted the concept of Digital Twin (DT). As one of the fundamental enabling technologies for Industry 4.0, DT enables the convergence between a physical system and its digital representation. DT modelling is the basis of implementing DT in practice. In this paper, we propose a DT modelling method based on a multi-agent architecture. It focuses on quality control during manufacturing processes and provides solutions to gather relevant information and analyze the corresponding influences on product quality. The MPFQ-model (Material, Production Process, Product Function/Future, Product Quality) is adopted to support the analysis of main influential factors related to the final product quality during the manufacturing phase. The five-dimension architecture is used as the basis for the DT models, including (i) physical entities, (ii) virtual models, (iii) DT data, (iv) services and (v) connections. Based on this architecture a Multi-Agent System (MAS) component and a semantic engineering component are integrated to create a quality-oriented DT framework. © 2020 The Authors. Published by Elsevier Ltd. This is an open access article under the CC BY-NC-ND license (https://creativecommons.org/licenses/by-nc-nd/4.0/) Peer-review under responsibility of the scientific committee of the FAIM 2021.",,Not started,Alex,"October 25, 2022 7:00 PM"
A framework for development of digital twin industrial robot production lines based on a mechatronics approach,Academic,Article,https://www.scopus.com/inward/record.uri?eid=2-s2.0-85135482043&doi=10.1142%2fS1793962323410258&partnerID=40&md5=7778bb2f70f267aa2dcd5b073c9e3b00,"Continuous optimization, Data fusion, Digital twin, Heterogeneous data, Industrial robots, Intelligent Manufacturing, Iterative Optimization, Manufacture, Multi-Sources, Physical world, Production line, Virtual worlds, industrial robot production line, mechatronics, system development, virtual reality",China,2022,"During the past years, intelligent manufacturing has attracted enormous attention from both academia and industry. Smart factories/workshops/production lines are important carriers for realizing intelligent manufacturing. However, there are difficulties in smart factories in processing multi-source heterogeneous data, in integrating virtual and physical worlds, and in achieving continuous and iterative optimization with real-time feedback. Digital twin, which is able to deeply integrate physical and virtual worlds, provides an important technology for easing the difficulties mentioned above. The construction of a digital twin system can solve the problem of data fusion, analysis, processing, and applications in smart factory. Digital production lines are the foothold of a smart factory. Building a digital twin production line can facilitate rapid practice of digital twins and promote the development of intelligent manufacturing. To this end, this paper proposes a development framework for a digital twin production line with closed-loop control based on a mechatronics approach. The detailed development process is given based on the framework. The framework proposed may provide some inspiration and insights for design and development of digital twin production lines. © 2023 World Scientific Publishing Company.",,Not started,Alex,"October 25, 2022 7:00 PM"
"Digital twin for sustainable manufacturing supply chains: Current trends, future perspectives, and an implementation framework",Academic,Article,https://www.scopus.com/inward/record.uri?eid=2-s2.0-85121967867&doi=10.1016%2fj.techfore.2021.121448&partnerID=40&md5=99f5654ba0f8db91e2240d79b8c3f17c,"'current, Artificial intelligence, Cyber physicals, Cyberphysical, Digital supply chain, Digital supply chain twin, Digital twin, Disruptive technology, Future perspectives, Implementation process, Intelligent manufacturing system, Internet, Internet of things, Life cycle, Literature review, Manufacture, Manufacturing, Physical systems, Real time systems, Supply chain management, Supply chains, Sustainability, Sustainable development, Sustainable manufacturing, Virtual systems, electronic commerce","France, India, Morocco, United States",2022,"A digital twin is an integration of virtual and physical systems using disruptive technologies. More precisely, it is a method of developing sustainable, intelligent manufacturing systems for attaining robust quality, reducing time, and customized products using real-time information throughout the product life cycle. This paper presents a systematic literature review of 98 research papers on various digital supply chain twin dimensions with sustainable performance objectives. The selected papers were reviewed and classified into three broad categories: components of the digital twin, applications in the manufacturing supply chain, and sustainability. Based on the review and future perspectives from the study, we suggest that advancements in technologies such as IoT, cloud computing, and blockchain have increased the potential of digital twin applications in the supply chain. The results indicate that a digital supply chain twin should include the things and humans from the entire supply chain and not be restricted to the local manufacturing systems. Based on our review findings, we present a sustainable digital twin implementation framework for supply chains. The proposed framework will guide future practitioners and researchers. © 2021",,Not started,Alex,"October 25, 2022 7:00 PM"
A framework for cyber-physical production system management and digital twin feedback monitoring for fast failure recovery,Academic,Article,https://www.scopus.com/inward/record.uri?eid=2-s2.0-85118424419&doi=10.1080%2f0951192X.2021.1992666&partnerID=40&md5=be4e165a3ca0a38aea2e01181d6a2873,"Coordination reactions, Cybe-physical production system, Cyber Physical System, Cyber physicals, Cyber-Physical Production System, Digital twin, Embedded systems, Fast failure recovery, Human-in-the-loop, Human-in-the-loop production system, Human-robot collaboration, Industry 4.0, Production system, Production system management, Workers', human-in-the-loop production systems, human–robot collaboration","Italy, Spain",2022,"With the ongoing Industry 4.0 (I4.0) revolution, plant management and supervision play a key role in the development and (re-)design of industrial plants. In the arising scenarios, the need to coordinate human workers and autonomous systems, sharing the same environment, teaming together, becomes a fundamental requirement. Indeed, even though automation in standard assembly lines has reached high efficiency and reliability, for complex and new applications, a certain amount of failure must be considered for future addressing. This paper presents a framework for the flexible coordination of such a complex and heterogeneous cyber-physical system. A digital Ttwin mirrors in real-time the plant system, while a dashboard displays plant status, providing the human operators with fundamental tools for supervision and prompt intervention in case of failure. The framework was developed and tested in an industrially relevant environment, specifically for the assembly of the interior of an aircraft fuselage. © 2021 Informa UK Limited, trading as Taylor & Francis Group.",,Not started,Alex,"October 25, 2022 7:00 PM"
Equipment Design Optimization Based on Digital Twin under the Framework of Zero-Defect Manufacturing,Academic,Conference Paper,https://www.scopus.com/inward/record.uri?eid=2-s2.0-85101774236&doi=10.1016%2fj.procs.2021.01.271&partnerID=40&md5=fc4318bd4beaffefcd6e9668d5114e4c,"Data acquisition, Data handling, Data utilization, Defects, Digital twin, Factories of the futures, Flow control, Industrial environments, Industrial scenarios, Industry 4.0, Initial development, Machine Design, Machine shops, Manufacturing concepts, Manufacturing process, Metadata, Production optimization, Zero-Defect Manufacturing",Greece,2021,"A digitalized Smart Factory can be considered as a data island. Moreover, engineers have focused on the development of new technologies and techniques not only for transforming information to data but also to achieve efficient data utilization to further optimize manufacturing processes. However, the Zero-Defect Manufacturing concept has emerged, where the main goal is production optimization. The cornerstone in achieving the factories of the future is to further optimize the design of new assets so as they comply with the unique requirements of the customers. Therefore, this paper proposes the conceptualization, design, and initial development of a platform for the utilization of data derived from industrial environments for the optimization of the equipment design. The main aspects of the proposed framework are the data acquisition, data processing and the simulation. The applicability of the proposed framework has been tested in a laboratory-based machine shop utilizing data from a real-life industrial scenario. © 2021 Elsevier B.V.. All rights reserved.",,Not started,Alex,"October 25, 2022 7:00 PM"
A multi-agent and internet of things framework of digital twin for optimized manufacturing control,Academic,Article,https://www.scopus.com/inward/record.uri?eid=2-s2.0-85120883750&doi=10.1080%2f0951192X.2021.2004619&partnerID=40&md5=d8eda692f9faeabfe3898b9fb2e66437,"Digital twin, Digital twin (DT), Intelligent agents, Intelligent manufacturing system, Manufacture, Manufacturing control, Multi agent, Multi agent systems, Multi-Agent System, Multi-agent system (MAS), Network protocols, Self organizations, Self- adaptations, Shopfloors, Traditional manufacturing, intelligent manufacturing system(IMS), intelligent shopfloor, self-adaptation, self-organization",China,2021,"The demand for customized products is increasing, which brings great challenges to the traditional manufacturing system. The traditional manufacturing system lacks the analysis and feedback of the data collected in manufacturing, which hinders the rational utilization of the resources. In order to reasonably allocate resources according to the production requirements and effectively avoid the influence of external interference on the manufacturing system, a framework for the intelligent digital twin shopfloor is proposed in this paper. The framework consists of three primary components, namely physical shopfloor, virtual shopfloor, and digital twin service system. A model of digital twin shopfloor, a self-organizing model which achieves automation function in physical shopfloor, and an adaptive model which provides additional external disturbance resistance in virtual shopfloor are developed to improve the above-mentioned components. The mechanism of a contract network protocol and some cooperation strategies used in multi-agents are applied to achieve the capabilities above, which improve the reconfiguration and response ability of the shopfloor. A design case is studied to illustrate that the intelligent digital twin shopfloor can configure resources and deal with disturbances effectively. © 2021 Informa UK Limited, trading as Taylor & Francis Group.",,Not started,Alex,"October 25, 2022 7:00 PM"
A data- And knowledge-driven framework for digital twin manufacturing cell,Academic,Conference Paper,https://www.scopus.com/inward/record.uri?eid=2-s2.0-85070560451&doi=10.1016%2fj.procir.2019.04.084&partnerID=40&md5=1d455040e6c1ce5ed59e1637546ad18e,"Cells, Controlling strategies, Cytology, Data Analytics, Digital twin, Digital twin manufacturing cell, Enabling technologies, Engineering education, Flexible manufacturing systems, Intelligent Manufacturing, Knowledge based, Knowledge based systems, Knowledge basis, Learning and cognitive, Smart product-service systems, Smart products",China,2019,"Intelligent manufacturing is regarded as the next generation manufacturing mode with powerful learning and cognitive capacities enabled by new generation information technologies such as Internet of Things, big data analytics, edge computing and artificial intelligence. To provide an insight into intelligent manufacturing, this paper takes autonomous manufacturing cell as implementation scenario and proposes a data- and knowledge-driven framework for digital twin manufacturing cell (DTMC), which could support autonomous manufacturing by an intelligent perceiving, simulating, understanding, predicting, optimizing and controlling strategy. In addition, three key enabling technologies including digital twin model, dynamic knowledge bases and knowledge-based intelligent skills for supporting the above strategy are analyzed. Then, the implementing methods of DTMC are introduced through a thus constructed digital twin robot, and the usage of data and knowledge for supporting the automous operations of DTMC is also discussed. Finally, benefits of DTMC in smart product-service systems (PSS) and its current challenges are summarized. © 2019 The Authors. Published by Elsevier B.V.",,Not started,Alex,"October 25, 2022 7:00 PM"
Digital twin in manufacturing: conceptual framework and case studies,Academic,Review,https://www.scopus.com/inward/record.uri?eid=2-s2.0-85123736057&doi=10.1080%2f0951192X.2022.2027014&partnerID=40&md5=41470f636ccde4f71dcb7f9b3d573673,"Automation and controls, Case-studies, Conceptual frameworks, Cybe-physical production system, Cyber Physical System, Cyber physicals, Digital twin, Embedded systems, Flow control, Industrial research, Industry 4.0, Life cycle, Manufacturing industries, Product life cycle management, Product lifecycle management, Production system, Review papers, Smart manufacturing, automation and control, cyber-physical production systems",United Kingdom,2022,"The digital twin (DT) concept has a key role in the future of the smart manufacturing industry. This review paper aims to investigate the development of the digital twin concept, its maturity and its vital role in the fourth industrial revolution. Having identified its potential functionalities for the digitalisation of the manufacturing industry, the digital twin concept, its origin and perspectives from both the academic and industrial sectors are presented. The identified research gaps, trends and technical limitations hampering the implementation of digital twins are also discussed. In particular, this review attempts to address the research question on how the digital twin concept can support the realisation of an integrated, flexible and collaborative manufacturing environment which is one of the goals projected by the fourth industrial revolution. To address this, a conceptual framework supporting an integrated product-process digital twin for application in digitised manufacturing is proposed. The application and benefits of the proposed framework are presented in three case studies. © 2022 The Author(s). Published by Informa UK Limited, trading as Taylor & Francis Group.",,Not started,Alex,"October 25, 2022 7:00 PM"
Digital Twin Architecture and Development Trends on Manufacturing Topologies,Academic,Book Chapter,https://www.scopus.com/inward/record.uri?eid=2-s2.0-85103855664&doi=10.1007%2f978-3-030-67270-6_10&partnerID=40&md5=31425542bd3db1dbf473c0f3290c5c54,"Digital twin, Industry 4.0, Model factory, Smart manufacturing",Singapore,2021,"In today’s competitive landscape, a growing number of enterprises are embarking on cyber-physical digitalization journeys to fulfil customer expectations and vitalize manufacturing processes in a cost-effective manner. Developing on top of Industry 4.0 paradigms, advanced robotics, predictive analytics, and process flow automation benefit from the use of digital replicas known as digital twins (DT). DT is a prevailing technology in manufacturing industries and leverages real-time monitoring, simulation, and decision-aid systems to generate feasible solutions to assist production operations, which can range from predictive maintenance to strategic planning. As a trending technology, many digital twin-driven approaches are formulated to achieve mass customization and implement smart product service systems. Hence, this chapter aims to provide insights into the various digital twin architectures and development trends in manufacturing environments. It also proposes the integration of other emerging technologies to allow stakeholders who are capitalizing on this technology to gain a significant competitive edge in the present competitive environment. With consideration to both business innovation and engineering product lifecycle management, this work serves as a guide to highlight the status of digital twin development trends and benefits with innovative use cases aiming at setting a consistent standard for digital twin creation throughout academia and industry. © 2021, The Author(s), under exclusive license to Springer Nature Switzerland AG.",,Not started,Alex,"October 25, 2022 7:00 PM"
